item-name	item-description	listing-id	seller-sku	price	quantity	open-date	image-url	item-is-marketplace	product-id-type	zshop-shipping-fee	item-note	item-condition	zshop-category1	zshop-browse-path	zshop-storefront-feature	asin1	asin2	asin3	will-ship-internationally	expedited-shipping	zshop-boldface	product-id	bid-for-featured-placement	add-delete	pending-quantity	fulfillment-channel	merchant-shipping-group	status
Vital Essentials Freeze-Dried Raw Beef Tripe Dog Treats All Natural USA Sourced & Made Grain Free All Breeds & Sizes Great for Training Travel Or Treating No Fillers 3 Pack 2.3 oz Each Resealable Bag		1025AASBN64	NS-VL4N-CRJ9	29.67		2023-10-25 07:31:18 PDT		y	1			11				B07P8RXDNR						B07P8RXDNR				AMAZON_NA	Migrated Template	Inactive
Speed Stick Power Antiperspirant Deodorant for Men, Unscented - 3 Ounce, Pack Of 6 (Packaging May Vary)		0907AS843TG	NT-LGW9-R82Y	24.99		2023-09-07 13:19:53 PDT		y	1			11				B001ET76VM						B001ET76VM				AMAZON_NA	Migrated Template	Inactive
ZuPreem Pure Fun Bird Food for Large Birds, 2 lb (Pack of 2) - Variety Blend of Fruit, FruitBlend Pellets, Vegetables, Nuts for Amazons, Macaws, Cockatoos		0828AZQ9ZQB	NT-WSYP-CWKC	35.98		2023-08-28 14:18:07 PDT		y	1			11				B07KPB66DL						B07KPB66DL				AMAZON_NA	Migrated Template	Inactive
Terro 3200 Spider Traps 4 in a package, (Pack of 4, 16 Traps Total)		0918AL44QAQ	NU-47NR-THNR	19.99		2023-09-18 10:11:11 PDT		y	1			11				B009UZAEEI						B009UZAEEI				AMAZON_NA	Migrated Template	Inactive
Redbarn All-Natural 4-6" Bully Springs Sticks for Dogs - Premium Grain-Free Single Ingredient Boredom Busting Dental Chew Rawhide Alternative - 3 Count		0326BR5YELM	NW-0IZ9-5HB7	23.99		2024-03-26 14:19:27 PDT		y	1			11				B005799UUK						B005799UUK				AMAZON_NA	Migrated Template	Inactive
PERT 2-in-1 Hydrating Shampoo and Conditioner 33.8oz With Pump (1 PACK)		0613A52FAB4	NX-05P2-7VAV	20.99		2023-06-13 08:22:04 PDT		y	1			11				B07QDBQ7CH						B07QDBQ7CH				AMAZON_NA	Migrated Template	Inactive
Chuckit! Dog Ball Launcher, Sport 14S - 2PK		1116AYF78MZ	NX-PWZV-QRTS	21.04		2023-11-16 12:10:51 PST		y	1			11				B07JN8LMJ1						B07JN8LMJ1				AMAZON_NA	Migrated Template	Inactive
Fancy Feast Gourmet Savory Chicken & Turkey Dry Cat Food (2-Bags) (16 OZ Each)		0401B60LQWN	NY-2FD2-B5X6	17.99		2024-04-01 13:12:40 PDT		y	1			11				B07CYW8PTR						B07CYW8PTR				AMAZON_NA	Migrated Template	Inactive
Vital Cat Freeze-Dried All-Natural Minnows Cat Treats, 0.5 oz.		1005AUXXQN6	NY-KBYQ-XE0Z	15.98		2023-10-05 13:35:18 PDT		y	1			11				B01B78II02						B01B78II02				AMAZON_NA	Migrated Template	Inactive
Avon Perfumed Skin Softener - Imari (2 Packs)		0112BX36BH9	NY-WIQU-2ZYG	11		2024-01-12 11:13:39 PST		y	1			11				B00DJITPR4						B00DJITPR4				AMAZON_NA	Migrated Template	Inactive
Motomco 32553 1# Gopher Killer		1101AU2215M	O1-N7ZI-5BTH	19.99		2023-11-01 10:44:00 PDT		y	1			11				B00C7MFU8Q						B00C7MFU8Q				AMAZON_NA	Migrated Template	Inactive
LAFEBER'S Tropical Fruit Gourmet Pellets Pet Bird Food, No Added Sugar, Made with Non-GMO and Human-Grade Ingredients, for Conures, 4 lb		0105BF7XIV6	O1-TNXX-LWOT	11		2024-01-05 14:44:14 PST		y	1			11				B08KGR67VR						B08KGR67VR				AMAZON_NA	Migrated Template	Inactive
Desert Essence Coconut Shampoo & Conditioner Bundle - 8 Fl Ounce - Nourishing for Dry Hair - Delightful Scent - Refreshes Skin - Coconut Oil		0922AXQRYSJ	O4-3AXV-HKSO	19.72		2023-09-22 14:46:37 PDT		y	1			11				B00N648M66						B00N648M66				AMAZON_NA	Migrated Template	Inactive
Johnson's Baby Powder, 200g		1012ADHTTBQ	O5-PB63-JDZP	7.21		2023-10-12 10:17:27 PDT		y	1			11				B07TQJH8QY						B07TQJH8QY				AMAZON_NA	Migrated Template	Inactive
Activ Beta by Natures Ocean, Instant Water for Betta and All Fresh Water Fish- BIO ACTIV Live AQUEOUS Solution- 1 Gallon		0906AOGYNWC	O6-OW3S-WMBB	19.99		2023-09-06 09:23:13 PDT		y	1			11				B07P89D66J						B07P89D66J				AMAZON_NA	Migrated Template	Inactive
ATTITUDE Extra Gentle Hair Conditioner for Sensitive Dry Scalp, Soothing Oat, Naturally Dervied Ingredients, Dermatologically Tested, Vegan Detangler, Unscented, 8 Fl Oz		0219B74B1I3	O7-0QUF-WQ8H	13.88		2024-02-19 13:20:08 PST		y	1			11				B07NFDJXVC						B07NFDJXVC				AMAZON_NA	Migrated Template	Inactive
Soft Scrub Cleanser, Lemon, 24 oz-2 pk		0724AE55PR2	O9-2RC5-9I4A	19.99		2023-07-24 12:44:40 PDT		y	1			11				B00GMO02LA						B00GMO02LA				AMAZON_NA	Migrated Template	Inactive
Ramard Total Calm and Focus for Horses Supplement - Magnesium & Calming Formula for Horse Show, Training, & Performance Mental Alertness Without Drowsiness, Show Safe, Perfect Prep for Horses 1 Pack		0404BCUUBSN	O9-MOJP-2XW8	72.47		2024-04-03 19:33:12 PDT		y	1			11				B003BCFRPC						B003BCFRPC				AMAZON_NA	Migrated Template	Inactive
Dorco Tinkle Eyebrow Razors for Women, Dermaplane Razor 6 Razors, Eyebrow Trimmer Dermaplaning Tool for Safe and Easy Thanksgiving Gift, Stocking Stuffer		0108BKV6IVY	OB-XTMR-31NK	5.43		2024-01-08 06:19:45 PST		y	1			11				B014HNOXZS						B014HNOXZS				AMAZON_NA	Migrated Template	Inactive
Natural Cork Background in 12 X 18		0401B5O8SGW	OB-Z1U2-D7ZJ	22.96		2024-04-01 10:15:03 PDT		y	1			11				B00GYCEH1Q						B00GYCEH1Q				AMAZON_NA	Migrated Template	Inactive
Checkups- Dental Dog Treats, 24ct 48 oz. for dogs 20+ pounds 2 Pack akj		1009A4VBG1U	OD-56K8-G26B	44.99		2023-10-09 08:01:45 PDT		y	1			11				B0785SFRPT						B0785SFRPT				AMAZON_NA	Migrated Template	Inactive
Natural Balance L.I.T. Sweet Potato and Venison Formula Dog Treats, Small Breed, 16-Ounce (2 Packs 8-Ounce each)		0824APZ7KN0	OD-WSBT-LTZU	20.95		2023-08-24 10:30:45 PDT		y	1			11				B00Q5HJR4M						B00Q5HJR4M				AMAZON_NA	Migrated Template	Inactive
(3 Pack) Feline Greenies SMARTBITES Hairball Control, Chicken Flavor (4.6 oz Per Pack)3		0314BVWBRDG	OD-ZS18-6F64	22.99		2024-03-14 07:41:16 PDT		y	1			11				B077YPPJN2						B077YPPJN2				AMAZON_NA	Migrated Template	Inactive
Primer Assembly with Cover for 07 Series Filter A20126		0830A6LJQGS	OE-XY8J-8UPW	16.99		2023-08-30 13:17:34 PDT		y	1			11				B07VXMJ266						B07VXMJ266				AMAZON_NA	Migrated Template	Inactive
Standard Disposable Paper Cupcake Liners / Baking Cups For Housewarming, 60-ct / Box (Pack of 4)		0912A56NG0M	OG-F3B1-ZOE7	22.99		2023-09-12 11:42:03 PDT		y	1			11				B017O9TAXM						B017O9TAXM				AMAZON_NA	Migrated Template	Inactive
Supreme Petfoods 3 Pack of Selective Naturals Meadow Loops, 2.8 Ounces each, with Timothy Hay and Thyme		0402B93QEGE	OH-6BV3-CASG	17.99		2024-04-02 14:14:08 PDT		y	1			11				B07SJVR8RB						B07SJVR8RB				AMAZON_NA	Migrated Template	Inactive
Ricola Throat Drops, Cherry Honey, 24 Count Per Bag (6 Pack)		1024A815ZTG	OI-K1T7-S02E	24.99		2023-10-24 09:52:08 PDT		y	1			11				B01MSBY1JI						B01MSBY1JI				AMAZON_NA	Migrated Template	Inactive
Feeling Fresh Roll OnDeodorant		0901ABY475S	OI-SHJ3-FW13	25.53		2023-09-01 09:51:14 PDT		y	1			11				B00AW7FDV2						B00AW7FDV2				AMAZON_NA	Migrated Template	Inactive
Yerba Prima Organic Psyllium Whole Husks 12 oz - Natural Dietary Fiber Supplement, Non GMO, Gluten Free, Keto and Vegan Friendly for Regularity Support, Unflavored		0803A4A2KYH	OJ-8TZE-SOAY	29.99		2023-08-03 05:29:24 PDT		y	1			11				B01FJFZZWI						B01FJFZZWI				AMAZON_NA	Migrated Template	Inactive
Dove go fresh Antiperspirant Deodorant, Cool Essentials 2.6 oz, Twin Pack		0712AG9O8HA	OL-YZGI-4DGZ	12.79		2023-07-12 07:57:15 PDT		y	1			11				B001C32YYO						B001C32YYO				AMAZON_NA	Migrated Template	Inactive
Nivea Men Body Cream Revitalising Body Cream, 13.5oz, with caring Vitamin E- for a revitalised skin feeling		0107BIK0W7Q	OM-FRVL-W3SL	12		2024-01-07 02:59:52 PST		y	1			11				B07L25G91D						B07L25G91D				AMAZON_NA	Migrated Template	Inactive
Greenies Aging Care Regular Natural Dental CareDog Treats, 27 oz. Pack (27 Treats)		0712AG7SPYM	OM-N7GW-K8J8	60		2023-07-12 07:08:47 PDT		y	1			11				B07JRH7HXY						B07JRH7HXY				AMAZON_NA	Migrated Template	Inactive
Motul 109471 8100 X-Clean EFE 5W30 1X5L		0404BCT6GO2	OM-YN9A-VNYO	60.2		2024-04-03 17:59:44 PDT		y	1			11				B081S5YL98						B081S5YL98				AMAZON_NA	Migrated Template	Inactive
Pentosin 1405216 CHF 11S High Performance Synthetic Hydraulic Fluid for Audi, Bentley, BMW, Chrysler, Dodge, Jeep, Mercedes-Benz, Mini, Porsche, Saab, Volkswagen, Volvo, and More; 5 Liter		0422BT1Z6F5	ON-C6AI-YZBB	103.52		2024-04-21 19:38:22 PDT		y	1			11				B008ESOQZU						B008ESOQZU				AMAZON_NA	Migrated Template	Inactive
Aquafresh Maximum Strength Sensitive + Gentle Whitening Toothpaste, Smooth Mint 5.6 oz (Pack of 3)		0326BQS4OPD	OO-TARL-LSU7	19.99		2024-03-26 08:29:30 PDT		y	1			11				B00E4MS5IO						B00E4MS5IO				AMAZON_NA	Migrated Template	Inactive
Fruitables Skinny Mini – Healthy Treats for Dogs – Low Calorie Training Treats – Free of Wheat, Corn and Soy – Apple Bacon – 12 Ounces		0207BM44LT0	OO-YDRO-HJB4	6.99		2024-02-07 11:35:32 PST		y	1			11				B00N5ZSC34						B00N5ZSC34				AMAZON_NA	Migrated Template	Inactive
Dechra Eicosa3FF SnipCaps (Large), for Dogs Over 30lbs, 60 Count (1810080)		0404BCWJUKE	OP-ZC3E-Z1YM	41.11		2024-04-03 19:23:20 PDT		y	1			11				B07YQH4775						B07YQH4775				AMAZON_NA	Migrated Template	Inactive
Finish Dishwasher Water Softener Salt for Bosch Dishwasher, 2.2 lbs (Pack of 3)		0208BO8KEAH	OR-ZBBW-W358	24.99		2024-02-08 11:43:20 PST		y	1			11				B07CRPYQ9C						B07CRPYQ9C				AMAZON_NA	Migrated Template	Inactive
Prince of Peace Organic Oolong Tea - 100 Tea Bags (Pack of 3)		0215BYYTOEW	OS-TY27-OTJD	20.99		2024-02-15 07:28:01 PST		y	1			11				B002LME6OQ						B002LME6OQ				AMAZON_NA	Migrated Template	Inactive
ULTRASWIM Conditioner, Value Pack of 3		0327BTGSH8Q	OT-TBJ3-D3AL	23.99		2024-03-27 10:25:35 PDT		y	1			11				B00GMP0I86						B00GMP0I86				AMAZON_NA	Migrated Template	Inactive
Hikari 17.6-Ounce Sinking Wheat Germ Pellets for Pets, Medium		0131B5PO132	OV-FIBE-7OZZ	19.99		2024-01-31 05:37:56 PST		y	1			11				B003WRI0L4						B003WRI0L4				AMAZON_NA	Migrated Template	Inactive
Juven Therapeutic Nutrition Drink Mix - Orange, (30 Packets)		0921AU4WORH	OW-HKUI-XQAK	78.97		2023-09-21 10:14:16 PDT		y	1			11				B001TDL5BK						B001TDL5BK				AMAZON_NA	Migrated Template	Inactive
Colgate Total Whitening Toothpaste Twin Pack - 6 Ounce (Pack of 2)		0202BBFL5TJ	P1-S3DM-QSKO	13.99		2024-02-02 14:31:23 PST		y	1			11				B001KYS2UA						B001KYS2UA				AMAZON_NA	Migrated Template	Inactive
True Metrix Blood Glucose Test Strips Box of 100 Count with Meter		0207BM4NGJ0	P2-BB3X-9RS1	25.99		2024-02-07 11:41:57 PST		y	1			11				B01M4KC7CT						B01M4KC7CT				AMAZON_NA	Migrated Template	Inactive
SKOUT'S HONOR: Stain & Odor Severe Mess - Advanced Formula DOG 35 oz. - NEW		0119BDZW1AO	P3-KVK2-764D	24.99		2024-01-19 11:54:11 PST		y	1			11				B09QV8VMRQ						B09QV8VMRQ				AMAZON_NA	Migrated Template	Inactive
NUCO Certified ORGANIC Paleo Gluten Free Vegan Coconut Wraps, 5 Count (One Pack of Five Wraps)		0915ADUYQ6I	P4-9KAF-BVKS	11.99		2023-09-15 10:05:24 PDT		y	1			11				B01INZMV1E						B01INZMV1E				AMAZON_NA	Migrated Template	Inactive
Tomorrow Dry Cow 10ML (3 Pack)		0305B6YTLXZ	P4-COU4-NWCY	23.99		2024-03-05 10:02:32 PST		y	1			11				B06XVJMYYJ						B06XVJMYYJ				AMAZON_NA	Migrated Template	Inactive
Vicks Nursery 1 Gallon Vaporizer with Night-Light Warm Steam Vaporizer for Baby Room		0522AGKQO5U	P4-R2P4-ALEB	39.99		2023-05-22 14:46:19 PDT		y	1			11				B00099YJH2						B00099YJH2				AMAZON_NA	Migrated Template	Inactive
ZuPreem Pure Fun Bird Food for Parrots & Conures, 2 lb (Pack of 2) - Blend of Fruit, FruitBlend Pellets, Vegetables, Nuts for Caiques, African Greys, Senegals, Amazons, Eclectus, Cockatoos		0126BUX0OLQ	P4-T2XB-ND3Z	36.99		2024-01-26 08:24:09 PST		y	1			11				B071H6XC43						B071H6XC43				AMAZON_NA	Migrated Template	Inactive
TUCKS Medicated Cooling Pads, 100 Count – Pads with Witch Hazel, Cleanses Sensitive Areas, Protects from Irritation, Hemorrhoid Treatment, Medicated Pads Used By Hospitals		0108BKWS26W	P5-GNMW-O2U7	6		2024-01-08 06:06:50 PST		y	1			11				B06ZYLFV8L						B06ZYLFV8L				AMAZON_NA	Migrated Template	Inactive
Earthborn Holistic Wet Cat Food Variety Pack - 3 Flavors (Catalina Catch, Harbor Harvest, and Monterey Medley) - 3 Ounces Each (12 Total Cans)		1127AP5117S	P7-NDK3-IURS	26.24		2023-11-27 10:59:53 PST		y	1			11				B01MQ46AGC						B01MQ46AGC				AMAZON_NA	Migrated Template	Inactive
Tresemme Botanique Nourish + Replenish Conditioner, Coconut Oil and Aloe Vera - 24 Fl Oz / 700 mL x 2 Pack		0830A6PFF2U	P8-LI1R-3HBA	23.99		2023-08-30 14:22:43 PDT		y	1			11				B07VLCL9MX						B07VLCL9MX				AMAZON_NA	Migrated Template	Inactive
SYLVANIA H7 LED Powersport Headlight Bulbs for Off-Road Use or Fog Lights - 2 Pack		0417BEWD36J	P8-Q4EF-NHAC	95		2024-04-17 02:17:56 PDT		y	1			11				B09DQ93PN9						B09DQ93PN9				AMAZON_NA	Migrated Template	Inactive
Urine OFF Puppy & Dog Odor & Stain Remover| Fresh Scent Carpet Cleaner Spray | Bio Enzymatic Stain & Urine Odor Eliminator | Pet Safe Cleaner | 1 gal.		0319B8MUHLQ	P9-06SR-ARI4	42.99		2024-03-19 06:26:18 PDT		y	1			11				B001ATFGUY						B001ATFGUY				AMAZON_NA	Migrated Template	Inactive
Ban Fresh Cotton 24-hour Invisible Antiperspirant, Roll-on Deodorant for Women and Men, Underarm Wetness Protection, with Odor-fighting Ingredients, 3.5 Fl Oz (Pack of 2)		0107BIJODUE	PA-W4TP-SG7Y	19		2024-01-07 02:59:53 PST		y	1			11				B005NERDB2						B005NERDB2				AMAZON_NA	Migrated Template	Inactive
New York Style Garlic Bagel Crisps, 7.2 oz (Pack of 3)		0105BF6RJPJ	PA-ZYLF-U3IK	19.99		2024-01-05 14:44:08 PST		y	1			11				B0044CTSPS						B0044CTSPS				AMAZON_NA	Migrated Template	Inactive
Trojan Her Pleasure Latex Condoms, Premium Lubricated, 12-Count Boxes (Pack of 3)		1018AS55V6Y	PB-H22K-DE15	30.47		2023-10-18 08:53:22 PDT		y	1			11				B00CGP9ZYE						B00CGP9ZYE				AMAZON_NA	Migrated Template	Inactive
API Weekend Pyramid Fish Feeders, 8 Count Total, Feeds 5 to 10 Fish Up to 3 Days Each		0404BCTSKR2	PC-KTUQ-KRVK	11.01		2024-04-03 18:27:36 PDT		y	1			11				B07PHV828J						B07PHV828J				AMAZON_NA	Migrated Template	Inactive
HIKARI Saki Turtle Food 20 oz, Pack of 2 (2 Items)		0107BIIODIP	PD-3JIO-LAEP	34.99		2024-01-07 02:59:52 PST		y	1			11				B07S1Q1YZT						B07S1Q1YZT				AMAZON_NA	Migrated Template	Inactive
Stella & Chewy'S Raw Coated Small Breed Chicken Recipe Dog Food 3.5Lb		0403BBPZP2B	PD-OOA1-NQ8G	32.99		2024-04-03 08:33:47 PDT		y	1			11				B071J1JJ9F						B071J1JJ9F				AMAZON_NA	Migrated Template	Inactive
Scrubbing Bubbles Bubbly Bleach Gel Toilet Bowl Cleaner, Rainshower, 1 Squeeze Bottle, 24 oz		0530A2TBUWS	PD-ZEJA-LFLM	16.99		2023-05-30 07:57:03 PDT		y	1			11				B07BWP4LPN						B07BWP4LPN				AMAZON_NA	Migrated Template	Inactive
Cachafaz Dulce de Leche 450g		1211VTS1BKI	PDP-1	30		2019-12-11 10:04:21 PST		y	1			11				B00872XG9A						B00872XG9A				AMAZON_NA	Migrated Template	Inactive
La Serenisima Dulce de Leche 1 kilo		0130XYNC16O	PDP-2	22		2020-01-30 07:17:39 PST		y	1			11				B007FTCH2I						B007FTCH2I				AMAZON_NA	Migrated Template	Inactive
Taste of the Wild 2 Pack Pacific Stream Puppy Dry Dog Food. (2) - 5 lb. Bags with Smoked Salmon. Grain Free Dog Food, 10 Lbs. Total		0408BPQ2SRN	PE-C2PB-9B52	48.99		2024-04-08 14:26:27 PDT		y	1			11				B07G5PKVGV						B07G5PKVGV				AMAZON_NA	Migrated Template	Inactive
DrTim’s Aquatics Ammonium Chloride Solution for Fishless Cycling - 4 oz., Treats 200 gal. – Fish Tank Cleaner for Saltwater, Freshwater & Reef Aquariums		0720A3YWIWO	PE-UI35-5Q89	7.98		2023-07-20 07:47:31 PDT		y	1			11				B00WSNYRDS						B00WSNYRDS				AMAZON_NA	Migrated Template	Inactive
Greenies Grain Free Regular Natural Dental Care Dog Treats, 36 oz. Pack (36 Treats)		0314BVYQ8LW	PF-0NB8-19Y0	60.99		2024-03-14 07:42:06 PDT		y	1			11				B01MUG1431						B01MUG1431				AMAZON_NA	Migrated Template	Inactive
Gold Bond Maximum Strength Medicated Anti-Itch Cream - 1 oz		0927AA5M0Y1	PG-O31U-AN9X	11.99		2023-09-27 08:59:25 PDT		y	1			11				B00NFUBCEU						B00NFUBCEU				AMAZON_NA	Migrated Template	Inactive
Proden PlaqueOff Dental Care for Dogs and Cats, 180gm		0402B98FXNA	PG-O3GJ-14QN	51.5		2024-04-02 14:07:36 PDT		y	1			11				B000QAEQXQ						B000QAEQXQ				AMAZON_NA	Migrated Template	Inactive
Petrodex Enzymatic Toothpaste for Dogs, Helps Reduce Tartar and Plaque Buildup, Poultry Flavor, 2 Pack		0618XASHC1U	PHILLIPS-1	22.99		2020-06-18 13:18:58 PDT		y	1			11				B07DWJWJ5W						B07DWJWJ5W				AMAZON_NA	Migrated Template	Inactive
Multipet Mr. Bill Plush Dog Toy 11" Length [Pet Supplies]		1208ZW5DT7I	PHILLIPS-15	10.99		2022-12-08 13:17:55 PST		y	1			11				B00II6XVUE						B00II6XVUE				AMAZON_NA	Migrated Template	Inactive
Pet-Ag Bene-Bac Plus Pet Gel - 1 g Tube, Pack of 4 - FOS & Probiotics for Dogs, Cats, Exotic & Wildlife Mammals		0219AWF8D5M	PHILLIPS-16	7.72		2023-02-19 01:03:38 PST		y	1			11				B00061MROA						B00061MROA				AMAZON_NA	Migrated Template	Inactive
Stewart Freeze Dried Dog Treats, Beef Liver, 4 oz, Grain Free & Gluten Free, Resealable Tub, Single Ingredient, Training Treat in Beef Liver, Salmon, Chicken Liver & Chicken Breast 4, 14, 21 oz		1208ZW1YTP9	PHILLIPS-17	15.99		2022-12-08 13:18:25 PST		y	1			11				B0002DGRRA						B0002DGRRA				AMAZON_NA	Migrated Template	Inactive
Cobalt Aquatics Tropical Flake, 5 oz, White/Black (20002N)		0711ZKUU2EM	PHILLIPS-3	16.99		2022-07-11 10:54:37 PDT		y	1			11				B015L1MPO6						B015L1MPO6				AMAZON_NA	Migrated Template	Inactive
biOrb Service Kit, Original Version (2 Pack)		0118ALCCTNF	PHILLIPS-30	27.99		2023-01-18 06:45:36 PST		y	1			11				B07KWXZJ7N						B07KWXZJ7N				AMAZON_NA	Migrated Template	Inactive
BiOrb Service Kit SIX PACK		0118ALGKOWO	PHILLIPS-31	59.99		2023-01-18 06:46:00 PST		y	1			11				B004L6ZURM						B004L6ZURM				AMAZON_NA	Migrated Template	Inactive
Iams 19014802326 Perfect Portions Pate Healthy Adult Salmon Recipe Wet Cat Food Tray, 2.6 oz		0118ALIMW9R	PHILLIPS-32	11.99		2023-01-18 06:47:24 PST		y	1			11				B073MR2JS9						B073MR2JS9				AMAZON_NA	Migrated Template	Inactive
FritzZyme Turbo Start 900 Saltwater (4 oz)		0118ALEJ4O5	PHILLIPS-33	27.99		2023-01-18 06:48:49 PST		y	1			11				B084GPBL98						B084GPBL98				AMAZON_NA	Migrated Template	Inactive
Natural Balance Limited Ingredient Dog Treats Potato & Duck Formula, 14 oz, 3 Pack		0118ALGSTJ5	PHILLIPS-34	29.99		2023-01-18 06:49:20 PST		y	1			11				B00DZSBGK2						B00DZSBGK2				AMAZON_NA	Migrated Template	Inactive
Tiki Cat Stix Grain Free Wet Mousse Treats for Cats Tuna 3ounce Pouches 12 Count		0118ALEURHC	PHILLIPS-35	56.99		2023-01-18 06:50:09 PST		y	1			11				B07NZPQHP5						B07NZPQHP5				AMAZON_NA	Migrated Template	Inactive
Nutro Crunchy Dog Treats with Real Mixed Berries 10oz - 2 Pack		0118ALGTMVZ	PHILLIPS-36	16.99		2023-01-18 06:50:54 PST		y	1			11				B073YJQ7BN						B073YJQ7BN				AMAZON_NA	Migrated Template	Inactive
Charlee Bear Dog Treats with Liver (3 Pack) 16 oz Each		0208A18E6JU	PHILLIPS-39	20.5		2023-02-08 14:59:40 PST		y	1			11				B077ZMJL5T						B077ZMJL5T				AMAZON_NA	Migrated Template	Inactive
PureBites Chicken Breast Freeze-Dried Treats Cats		0220AZQEMIX	PHILLIPS-41	7.3		2023-02-20 09:25:09 PST		y	1			11				B074KXFNFB						B074KXFNFB				AMAZON_NA	Migrated Template	Inactive
Sentry Calming Collar for Dogs (3 Pack)		0220AZRSGHM	PHILLIPS-42	29.99		2023-02-20 09:25:11 PST		y	1			11				B0083F95O6						B0083F95O6				AMAZON_NA	Migrated Template	Inactive
Royal Canin Feline Health Nutrition Mother & Babycat Ultra Soft Mousse in Sauce Canned Cat Food, 3 oz can (12-count)		0306A1PK6M0	PHILLIPS-43	39.99		2023-03-06 10:16:15 PST		y	1			11				B077Y8KGXS						B077Y8KGXS				AMAZON_NA	Migrated Template	Inactive
Pet Botanics Mini Training Rewards for Dogs 3 Flavor Variety Bundle: (1) Bacon, (1) Chicken and (1) Beef, 4 Oz Ea (200 Count per Bag, 3 Bags Total)		0818A9SCRV8	PHILLIPS-44	22.99		2023-08-18 06:55:44 PDT		y	1			11				B01CXJFO5Q						B01CXJFO5Q				AMAZON_NA	Migrated Template	Inactive
Pet Botanics Mini Training Reward Treats 3PACK Beef (4 oz each)		0818A9OY6RM	PHILLIPS-45	18.62		2023-08-18 06:57:06 PDT		y	1			11				B0012S7Y2Q						B0012S7Y2Q				AMAZON_NA	Migrated Template	Inactive
Crazy Dog Train-Me! Training Reward Dog Treats,Chicken Regular		0818A9M9MSD	PHILLIPS-46	20.57		2023-08-18 06:58:26 PDT		y	1			11				B074KYWPZM						B074KYWPZM				AMAZON_NA	Migrated Template	Inactive
Buddy Biscuits Soft and Chewy Dog Treats w/Peanut Butter - 12oz.		0818A9KANVC	PHILLIPS-47	16.27		2023-08-18 06:59:15 PDT		y	1			11				B07NW5KNQ6						B07NW5KNQ6				AMAZON_NA	Migrated Template	Inactive
Buddy Biscuits Oven-Baked, Healthy Whole-Grain, Crunchy Treats for Dog		0818A9OZXFP	PHILLIPS-48	15.1		2023-08-18 07:00:05 PDT		y	1			11				B07K78K495						B07K78K495				AMAZON_NA	Migrated Template	Inactive
Cloud Star Buddy Wash Lavender and Mint, 16 Ounce (Pack of 2)		0818A9KES86	PHILLIPS-49	32.99		2023-08-18 07:01:29 PDT		y	1			11				B07DFDF897						B07DFDF897				AMAZON_NA	Migrated Template	Inactive
Cloud Star Buddy Wash Lavender & Mint 2-in-1 Dog Shampoo + Conditioner 32 Oz		0818A9NHNRX	PHILLIPS-50	25		2023-08-18 07:02:41 PDT		y	1			11				B07DFBTXYQ						B07DFBTXYQ				AMAZON_NA	Migrated Template	Inactive
Fritz MetroCleanse - 20 pk		0818A9NRTLJ	PHILLIPS-51	17.99		2023-08-18 07:03:32 PDT		y	1			11				B09WND1NMG						B09WND1NMG				AMAZON_NA	Migrated Template	Inactive
Green Coast Pet All-Natural Pawnut Butter for Dogs | Made in USA | Peanut & Flaxseed Blend		0818A9R5XK4	PHILLIPS-52	14.5		2023-08-18 07:04:25 PDT		y	1			11				B07BW31J73						B07BW31J73				AMAZON_NA	Migrated Template	Inactive
New Life Spectrum Naturox Series Cichlid Formula Supplement, 300g		0818A9OMRI1	PHILLIPS-53	22.99		2023-08-18 07:05:31 PDT		y	1			11				B077MG3WZY						B077MG3WZY				AMAZON_NA	Migrated Template	Inactive
True Chews Premium Jerky Bites Made with Real Chicken 12oz (TC-08385)		0818A9KEKGN	PHILLIPS-54	25.99		2023-08-18 07:06:40 PDT		y	1			11				B07W81Y4LR						B07W81Y4LR				AMAZON_NA	Migrated Template	Inactive
Applaws Natural Cat Treats, 12 Count, Grain Free Cat Treats, Single Ingredient Treats for Cats, Whole Tuna Loin, 12 x 1.06oz		0809ZGROK4R	PHILLIPS-6	36.99		2022-08-09 07:03:55 PDT		y	1			11				B01N2W1LGV						B01N2W1LGV				AMAZON_NA	Migrated Template	Inactive
PureBites Chicken Breast for Dogs, 11.6oz / 330g - Super Value Size		1011ZUTZFOI	PHILLIPS-7	30.99		2022-10-11 11:16:19 PDT		y	1			11				B000Z3MBRM						B000Z3MBRM				AMAZON_NA	Migrated Template	Inactive
TOMLYN Pill-Masker Original Bacon-Flavored Paste for Dogs & Cats, 4oz, Pack of 2		1011ZUWVQ2Q	PHILLIPS-8	26.99		2022-10-11 11:19:14 PDT		y	1			11				B071FWFVPH						B071FWFVPH				AMAZON_NA	Migrated Template	Inactive
Charlee Bear Dog Treats Variety Pack includes Liver, Egg and Cheese, Chicken and Garden Vegetable, Turkey Liver and Cranberries (4 Pack)		1028ZYJKX0X	PHILLIPS-9	27.95		2022-10-28 08:11:25 PDT		y	1			11				B079QFP1F5						B079QFP1F5				AMAZON_NA	Migrated Template	Inactive
Always Dailies Liners Thong Mini-Slip 42 Count (2 Pack)		0217AQT3JCZ	PJ-1	19.99		2023-02-17 08:34:31 PST		y	1			11				B009F27Z34						B009F27Z34				AMAZON_NA	Migrated Template	Inactive
Swiffer Duster Refill + 1 Handle (28 Count)		0217AQZ4FLH	PJ-2	27.99		2023-02-17 08:34:44 PST		y	1			11				B07DJNKG5J						B07DJNKG5J				AMAZON_NA	Migrated Template	Inactive
Swiffer Dusters Dusting Kit, Starter Kit Handle & 28 Duster Refills, 1 Count (Pack of 29), White		0217AQX33KP	PJ-3	27.99		2023-02-17 08:35:18 PST		y	1			11				B07683FW6Y						B07683FW6Y				AMAZON_NA	Migrated Template	Inactive
Vaseline Petroleum Jelly Cream, Deep Moisture, 4.5 Ounce (Pack of 4)		0217AQW7ZWJ	PJ-4	23.99		2023-02-17 08:35:37 PST		y	1			11				B00KP5FP9G						B00KP5FP9G				AMAZON_NA	Migrated Template	Inactive
Fixodent Ultra Max Hold Dental Adhesive (2.2 oz. 3 pk.)		0217AQT3LLB	PJ-5	25.99		2023-02-17 08:35:59 PST		y	1			11				B07JB46ZYL						B07JB46ZYL				AMAZON_NA	Migrated Template	Inactive
Luvs with Ultra Leak Guards Diapers, Size 1, 48 Count		0217AQWS2BI	PJ-6	25.99		2023-02-17 08:36:20 PST		y	1			11				B00QJ7YMDO						B00QJ7YMDO				AMAZON_NA	Migrated Template	Inactive
(2 Pack) Zoo Med Reptisun 10.0 Uvb Mini Compact Fluorescent		0401B5RQ3AC	PK-IDMB-SGXI	29.5		2024-04-01 10:11:15 PDT		y	1			11				B015HU2HF8						B015HU2HF8				AMAZON_NA	Migrated Template	Inactive
Household OxiClean Laundry Stain Remover Bundle Pack		0415B9E8HGZ	PL-5V56-AFIG	23.99		2024-04-15 11:13:03 PDT		y	1			11				B09N7XXGXH						B09N7XXGXH				AMAZON_NA	Migrated Template	Inactive
Dechra TrizEDTA Aqueous Flush For Dogs & Cats (16oz)		0220B8O6UET	PL-ISJU-XF2W	36.99		2024-02-20 08:36:26 PST		y	1			11				B07YQGZ9L8						B07YQGZ9L8				AMAZON_NA	Migrated Template	Inactive
Terro 1806 Outdoor Liquid Ant Baits, 1.0 fl. oz. - 6 count		1009A5CZ13Y	PL-QCFD-DFBC	28.99		2023-10-09 13:45:04 PDT		y	1			11				B004Q3QQNC						B004Q3QQNC				AMAZON_NA	Migrated Template	Inactive
Surrender Fire Ant 1lb		1204A66A68Z	PL-UW28-7NMX	39.99		2023-12-04 10:50:03 PST		y	1			11				B07PML81JN						B07PML81JN				AMAZON_NA	Migrated Template	Inactive
Jungle TB605W Tank Buddies Ammonia Clear Tablets, 8-Count		0829A39Z0NX	PN-7LSC-06GT	14.99		2023-08-29 13:01:20 PDT		y	1			11				B0002APVNE						B0002APVNE				AMAZON_NA	Migrated Template	Inactive
Valvoline General Purpose Amber Grease 14.1 OZ Cartridge, Case of 10		0409BS0UCQ3	PN-LZ8Z-I0HV	61.91		2024-04-09 06:10:25 PDT		y	1			11				B082P79JV6						B082P79JV6				AMAZON_NA	Migrated Template	Inactive
Nylabone Advanced Oral Care Cat Dental Kit Original (3 Count)		1205A8EUY6I	PN-TKX5-KEO5	8		2023-12-05 07:00:53 PST		y	1			11				B00751700A						B00751700A				AMAZON_NA	Migrated Template	Inactive
Almay Sensitive Skin, Clear Gel Fragrance Free - 2.25 oz, (Pack of 6)		1129AURX1WJ	PO-9XZO-JVJO	26.99		2023-11-29 14:02:52 PST		y	1			11				B07N5MF3N6						B07N5MF3N6				AMAZON_NA	Migrated Template	Inactive
Nestle Purina Petcare 20 oz Friskies Party Mix Gravy-licious Chicken & Gravy Flavors Cat Treats - (Pack of 3)		0401B5XKHN6	PO-M772-YN9Z	39.99		2024-04-01 13:19:08 PDT		y	1			11				B07P2Z887T						B07P2Z887T				AMAZON_NA	Migrated Template	Inactive
