item-name	item-description	listing-id	seller-sku	price	quantity	open-date	image-url	item-is-marketplace	product-id-type	zshop-shipping-fee	item-note	item-condition	zshop-category1	zshop-browse-path	zshop-storefront-feature	asin1	asin2	asin3	will-ship-internationally	expedited-shipping	zshop-boldface	product-id	bid-for-featured-placement	add-delete	pending-quantity	fulfillment-channel	merchant-shipping-group	status
Simply Organic Organic Chili Powder ( 1X2.89 Oz)		0227BOM7XFE	01-CVKH-NOE4	9.8		2024-02-27 10:41:51 PST		y	1			11				B005GX6NKM						B005GX6NKM				AMAZON_NA	Migrated Template	Active
Grannicks Bitter Apple Taste Deterrent for Dogs (New Version)		0403BBHN7XT	07-UW90-6TC3	14.99		2024-04-03 08:03:46 PDT		y	1			11				B082GC6NNW						B082GC6NNW				AMAZON_NA	Migrated Template	Active
Durvet Healthy Flock Poultry Probiotics		0129B19C6LP	0H-IUWM-KKHZ	13.99		2024-01-29 09:11:25 PST		y	1			11				B06XXWZGSV						B06XXWZGSV				AMAZON_NA	Migrated Template	Active
Vital Cat Vital Essentials Minnows Freeze-Dried Cat Treats - All Natural Raw Treat - Made & Sourced in USA - Grain Free - 0.5 oz Resealable Pouch - 3 Pack		1005AUVAQCN	0H-YSUF-OIVF	22.99		2023-10-05 13:35:42 PDT		y	1			11				B07KJNGYZR						B07KJNGYZR				AMAZON_NA	Migrated Template	Active
Redbarn Chew-A-Bulls (Size: Mini | Shape: Hydrant | 48-Count (Pack of 1))		1220ADMKZPC	0J-7PZV-ETQB	16.4		2023-12-20 05:44:50 PST		y	1			11				B08VJL6FTL						B08VJL6FTL				AMAZON_NA	Migrated Template	Active
Colgate Total Whitening Toothpaste Gel, 3.3 oz (Pack of 3)		0226BMFRCK4	0K-0VV5-4VF3	12.99		2024-02-26 13:45:36 PST		y	1			11				B07PB39VVL						B07PB39VVL				AMAZON_NA	Migrated Template	Active
Zoo Med Wipe Out 1 Disinfectant, 32 oz		1127AP5E00R	0T-FZ5A-ZT7H	19.8		2023-11-27 11:03:53 PST		y	1			11				B0006G5F0S						B0006G5F0S				AMAZON_NA	Migrated Template	Active
Camay Soap 3Ct X 125G Naturel		0315BYZR8X9	0X-E4PB-WWRR	6.99		2024-03-15 08:13:49 PDT		y	1			11				B075XTV6FQ						B075XTV6FQ				AMAZON_NA	Migrated Template	Active
Redbarn All-Natural Lamb Lung Filets for Dogs - Premium Grain-Free Single Ingredient Dental Treats - Made in USA with No Artificial Ingredients - 10 oz Bag		1018AS06U2P	13-JRZY-NZ3I	24.99		2023-10-18 07:20:19 PDT		y	1			11				B08VFFHS38						B08VFFHS38				AMAZON_NA	Migrated Template	Active
Yaucono Ground Coffee, Medium Roast, 10 Ounce Can (Pack of 2)		0329AY6D39T	1C-Q5L8-HMJQ	19.5		2023-03-29 09:04:46 PDT		y	1			11				B00BBF9CTI						B00BBF9CTI				AMAZON_NA	Migrated Template	Active
Nutri-Vet K9 Dog Aspirin for Small Dogs 100ct		0204BEXVBNT	1D-HGP6-SPH1	14.5		2024-02-04 12:48:49 PST		y	1			11				B01FUG7BL4						B01FUG7BL4				AMAZON_NA	Migrated Template	Active
(3 Pack) Nutri Source Soft/Tender Dog Treat Flavor: Salmon 6-Ounces		1127AP8B92Q	1L-WZNJ-9IXI	16.17		2023-11-27 11:51:05 PST		y	1			11				B01EX695BG						B01EX695BG				AMAZON_NA	Migrated Template	Active
Refresh Your Car! 09584 Auto Vent Stick, Cucumber Melon, 4 Per Pack		0613A56SEAS	1P-YEBR-ATV8	5.96		2023-06-13 08:22:32 PDT		y	1			11				B0023UUUPA						B0023UUUPA				AMAZON_NA	Migrated Template	Active
Attitude, Super Leaves Science, Natural Conditioner, Nourishing & Strengthening, Grape Seed Oil & Olive Leaves, 8 oz (240 ml)		0219B72LCY3	1W-6GXU-VJ9J	23.99		2024-02-19 13:18:01 PST		y	1			11				B0722X7RHN						B0722X7RHN				AMAZON_NA	Migrated Template	Active
Dr. Marty Nature's Blend for Active Vitality Seniors Freeze Dried Raw Dog Food, 16 oz		0129B1D85LU	1Y-RWMG-KGP2	38.27		2024-01-29 09:06:21 PST		y	1			11				B0BKX71R2H						B0BKX71R2H				AMAZON_NA	Migrated Template	Active
FreeStyle Freedom Lite Blood Glucose Meter		0126BUUDWHN	21-5CNU-XGLI	26.99		2024-01-26 08:17:20 PST		y	1			11				B002G3EJ1K						B002G3EJ1K				AMAZON_NA	Migrated Template	Active
VAN NESS PLASTIC MOLDING Fura-Zone Ointment for Horses, 1 Pound Container		0223BGKSA5G	26-5XX5-RW2X	24.49		2024-02-23 12:31:53 PST		y	1			11				B003NYA3SO						B003NYA3SO				AMAZON_NA	Migrated Template	Active
Ivermectin Paste - Horse Wormer 1 Tube 6.08 Grams (3-Pack)		0404BCWAQFY	27-NIXL-QSGT	27.95		2024-04-03 19:06:38 PDT		y	1			11				B09876FTGV						B09876FTGV				AMAZON_NA	Migrated Template	Active
Nylabone 3 Pack of Bacon Puppy Teething Keys, Large		0305B77CC1P	2D-9ZYA-3DN1	21.5		2024-03-05 11:27:48 PST		y	1			11				B07WHHTCP4						B07WHHTCP4				AMAZON_NA	Migrated Template	Active
A&W Root Beer Caffeine/Sugar Free Classic On-the-Go Drink Mix Packets - 1 Box (6 pks)		0327BTEVH7G	2D-FTBP-EOP6	4		2024-03-27 10:21:43 PDT		y	1			11				B088FYND26						B088FYND26				AMAZON_NA	Migrated Template	Active
Better Than Bouillon Vegetarian No Beef Base, Made with Seasoned Vegetables, Certified Vegan, Makes 9.5 Quarts of Broth, 38 Servings 8 Ounce (Pack of 1)		1220ADLWTD1	2E-VIXH-OOD0	10.99		2023-12-20 05:44:53 PST		y	1			11				B004W9SLPQ						B004W9SLPQ				AMAZON_NA	Migrated Template	Active
Refresh Tears Lubricant Eye Drops, 0.5 Fl Oz (4 Count) 2X Twin Pack		1011AALJ0ZM	2P-6CBR-50F7	22.5		2023-10-11 11:17:45 PDT		y	1			11				B07YZN27K5						B07YZN27K5				AMAZON_NA	Migrated Template	Active
Crest Complete Multi-Benefit With Extra Advantage Whitening Plus Scope Toothpaste - Fresh Mint Striped 8.2oz (Pack of 3)		0110BRHENF0	2R-7B3K-NDHZ	16.99		2024-01-10 09:57:08 PST		y	1			11				B00DDUJEE2						B00DDUJEE2				AMAZON_NA	Migrated Template	Active
Vaseline Men Healing Moisture Body Lotion, Fast Absorbing, 20.3 oz		0129B1DVYWS	2X-N01P-DXXD	11.99		2024-01-29 10:18:46 PST		y	1			11				B001ECQ55M						B001ECQ55M				AMAZON_NA	Migrated Template	Active
Open Farm Beef Dehydrated Dog Treats, 4.5-oz		0911A2GIUT2	2Y-VS2M-T7CO	15.9		2023-09-11 14:09:11 PDT		y	1			11				B09PM85613						B09PM85613				AMAZON_NA	Migrated Template	Active
AminAvast Kidney Support Supplement for Cats and Dogs, 1000mg 2-Pack - Promotes Natural Kidney Function - Aids in Health and Vitality of Aging Kidneys - Easily Administered - 60 Sprinkle Capsules		0319B8J7JQZ	35-S92W-IENF	92.49		2024-03-19 06:36:02 PDT		y	1			11				B0BLZL8HMQ						B0BLZL8HMQ				AMAZON_NA	Migrated Template	Active
Crazy Dog Train-Me! Training Reward Dog Treats 3 Flavor Variety Bundle: (1) Train-Me! Bacon Flavor, (1) Train-Me! Chicken Flavor, and (1) Train-Me! Beef Flavor, 4 Oz. Ea. (3 Bags Total)		1127AP2EKN1	3I-8JXX-VI5M	19.99		2023-11-27 10:59:00 PST		y	1			11				B013IZPXNC						B013IZPXNC				AMAZON_NA	Migrated Template	Active
Aion Outdoor Fly Traps with Natural Bait Attractant and Hanging Hooks for Trapping Fruit and Horse Flies, Gnats, and Flying Insects or Bugs, Patio, Camping, and Backyard Disposable Catchers, 2 Pack		0410BV2CE4U	3L-LDB1-7DYH	22.99		2024-04-10 07:05:32 PDT		y	1			11				B0CLHBP93N						B0CLHBP93N				AMAZON_NA	Migrated Template	Active
CeraVe Healing ointment | 3 ounce | cracked skin repair skin protectant with petrolatum ceramides | lanolin & fragrance free, 3 Ounce		0312BOP53B7	3M-DRM5-GOKP	13.99		2024-03-12 06:21:07 PDT		y	1			11				B07XYH18MW						B07XYH18MW				AMAZON_NA	Migrated Template	Active
ZuPreem Sensible Seed Bird Food for Parrots and Conures, 2 lb bag (2-pack) - Premium Blend of Seeds and FruitBlend Pellets for Conures, Caiques, African Greys, Senegals, Amazons, Eclectus, Small Cocka		1003AORMUP7	3Q-MGBQ-LXOL	31		2023-10-03 13:09:11 PDT		y	1			11				B07KRL1R1Q						B07KRL1R1Q				AMAZON_NA	Migrated Template	Active
Grannick's Care Dogs Bitter Apple No Chew Spray 8oz		0403BBKOW22	41-582V-PNBS	15.99		2024-04-03 08:00:13 PDT		y	1			11				B01KNFI86E						B01KNFI86E				AMAZON_NA	Migrated Template	Active
Nutri Source TU80022 14 oz Soft & Tender Salmon Treats		1231A2ULXCZ	45-7EN8-DDW9	13.02		2023-12-31 07:05:33 PST		y	1			11				B096WJB8YC						B096WJB8YC				AMAZON_NA	Migrated Template	Active
VetOne O3 Omega Soft Gel for Large Dogs - Essential Fatty Acid Support - Skin & Coat Supplement - 250 Capsules		1220ADLWVYN	48-ZQYT-HWPN	40.36		2023-12-20 05:44:50 PST		y	1			11				B00XM2V38G						B00XM2V38G				AMAZON_NA	Migrated Template	Active
ARC KwikStop Styptic Powder (14 gm)		1101ATVN00J	4B-2XIT-NJ68	13.47		2023-11-01 10:44:16 PDT		y	1			11				B00WZ9E75I						B00WZ9E75I				AMAZON_NA	Migrated Template	Active
LITTLE GIANT Steel Small Animal Feeder with Lid - Pet Lodge - Small Animal Feed Box, Hold Several Days Worth of Feed, Great for Rabbits, Ferrets and Other Small Animals (7 Inch) (Item No. AF7ML)		0411A2SQF1I	4D-3WX7-KVRF	16		2023-04-11 08:16:24 PDT		y	1			11				B0084NNYGM						B0084NNYGM				AMAZON_NA	Migrated Template	Active
Always Ultra Thin Long Super Pads, 20-Count		1201AZZ2BES	4D-QH0Z-IN2W	8		2023-12-01 11:07:27 PST		y	1			11				B0001KOCHG						B0001KOCHG				AMAZON_NA	Migrated Template	Active
Equus Magnificus, Inc.-German Horse Muffin All Natural Horse Treats 6 Pound		1020AYFQB7A	4J-12PT-LPFB	33.8		2023-10-20 08:17:23 PDT		y	1			11				B00GD45TO4						B00GD45TO4				AMAZON_NA	Migrated Template	Active
Calcium with Vitamins from Rep Cal		1009A4N2ZA6	4K-10WZ-FIBC	11.4		2023-10-09 07:50:33 PDT		y	1			11				B0013F2IHO						B0013F2IHO				AMAZON_NA	Migrated Template	Active
Vedco Swimmer's Ear Astringent for Dogs 4oz.		0220B8YYLG4	4S-M5J9-J5YA	9.9		2024-02-20 08:40:57 PST		y	1			11				B07SD3NTNH						B07SD3NTNH				AMAZON_NA	Migrated Template	Active
Lysol All Purpose Cleaner with Bleach, 32 Ounce (Pack of 2)		0327BTQ3KDM	4W-UEWN-4M5A	22.5		2024-03-27 13:36:24 PDT		y	1			11				B0BVXRCW4N						B0BVXRCW4N				AMAZON_NA	Migrated Template	Active
Marshall Bandits Ferret Treat, 3-Ounce, Chicken (Pack of 4)		1127AP84PHJ	55-WKSQ-6FB6	18.5		2023-11-27 10:54:34 PST		y	1			11				B00U4F1FO6						B00U4F1FO6				AMAZON_NA	Migrated Template	Active
OptixCare Pet Eye Lube Plus + Hyaluron 20g for Dog Cat Horses		1113APPJLYT	5B-JMVX-BVJS	14.99		2023-11-13 12:20:59 PST		y	1			11				B07C1ML943						B07C1ML943				AMAZON_NA	Migrated Template	Active
Redbarn Filled Dog Bones | Natural Long-Lasting Dental Treats; Suitable for Aggressive Chewers | Large (6") - 5 Bones (Peanut Butter)		1018ARXU3PU	5C-VXKL-H6DN	38.5		2023-10-18 07:20:28 PDT		y	1			11				B01DMY6SPG						B01DMY6SPG				AMAZON_NA	Migrated Template	Active
VL Goldenfeast Madagascar Blend, 3 lb Bag		1127AP2PWB8	5E-VMM2-E1Z3	24.99		2023-11-27 11:25:08 PST		y	1			11				B092SYVHRQ						B092SYVHRQ				AMAZON_NA	Migrated Template	Active
Vet One NDC 13985-447-16		0201B88BAM8	5G-9QOX-YMLW	31.71		2024-02-01 08:04:32 PST		y	1			11				B09RJKRMZ4						B09RJKRMZ4				AMAZON_NA	Migrated Template	Active
AniMed Methenamine Pure Multi-Species Pet Supplement, 16-Ounce		1127AP6CKKS	5I-47OI-SZ45	28.99		2023-11-27 11:33:29 PST		y	1			11				B004W35X1M						B004W35X1M				AMAZON_NA	Migrated Template	Active
ATTITUDE Disposable Diapers for Sensitive Skin, Non-Toxic, Hypoallergenic, Chlorine-Free, Dye-Free & Lotion-Free Biodegradable Baby Diapers, Plain White (Unprinted), Size 0 (Up to 11 lbs), 28 Count		0219B73WHFQ	5I-DZP0-JDZO	27.99		2024-02-19 13:20:45 PST		y	1			11				B084DCRTDK						B084DCRTDK				AMAZON_NA	Migrated Template	Active
Pet Greens 4 Pack Cat Grass Garden Wheatgrass self Grow and Medley Oat, Rye and Barley, 2 of Each 3oz Package		0313BRXYM22	5K-M3PM-KBGS	26.99		2024-03-13 09:21:36 PDT		y	1			11				B08G9QXPG3						B08G9QXPG3				AMAZON_NA	Migrated Template	Active
Kaytee Apple Orchard Sticks 10pk		0223BGJY14C	5N-FGNN-2P4H	14.99		2024-02-23 12:39:08 PST		y	1			11				B07ZJV4PBN						B07ZJV4PBN				AMAZON_NA	Migrated Template	Active
Probios Vet Plus Dispersible Digestive Powder, 240gm		0905ALV7NVC	5Y-9CCD-3LL4	20.8		2023-09-05 13:27:42 PDT		y	1			11				B07L632N49						B07L632N49				AMAZON_NA	Migrated Template	Active
Redbarn All-Natural Air Dried Beef Training Treats for Puppies & Dogs – Grain-Free Single Protein Rewards Made in USA for Small, Medium, & Large Breeds - 8 oz Resealable Bag		1018AS054TD	5Y-RBX7-SQ5K	11.3		2023-10-18 07:18:33 PDT		y	1			11				B07WSGCFKD						B07WSGCFKD				AMAZON_NA	Migrated Template	Active
Redbarn All-Natural Premium Rolled Dog Food, Beef Recipe - Soft Semi-Moist Wet Formula for High Protein Diet, Training Rewards, & Treat Pill Concealer - 4 lb. (1 Count)		1018ARYDXOW	5Z-BQ6F-FU74	19.99		2023-10-18 07:18:12 PDT		y	1			11				B00008DFOG						B00008DFOG				AMAZON_NA	Migrated Template	Active
Dr. Marty Nature's Blend Sensitivity Select Freeze-Dried Raw Dry Dog Food 16 oz		0227BOQG8FO	62-PTPP-PI5O	42.9		2024-02-27 10:24:12 PST		y	1			11				B0BWWZRDX9						B0BWWZRDX9				AMAZON_NA	Migrated Template	Active
Liqui Moly Long-Life Grease + MoS2 | 100 g | Lithium Fat | SKU: 2003		0315BYVXY29	64-FLIO-ZP1K	11.45		2024-03-15 08:42:55 PDT		y	1			11				B01BSMMJ2A						B01BSMMJ2A				AMAZON_NA	Migrated Template	Active
Lambert Kay Fresh 'N Clean Scented Shampoo Professional Dog and Cat Grooming 18 oz Ready Use		0329AYB9B7U	64-I42H-SAGU	16.5		2023-03-29 09:04:06 PDT		y	1			11				B0718WB2TT						B0718WB2TT				AMAZON_NA	Migrated Template	Active
Happy Hen (Case of 6) Treats 7.5 oz. Square-Mealworm and Peanut, 4.25" by 4.25" by 1.25"		1127APBAO1Z	6F-H5WV-UKFC	29.9		2023-11-27 11:36:10 PST		y	1			11				B06XX2CX57						B06XX2CX57				AMAZON_NA	Migrated Template	Active
Dr. Marty Nature's Blend Freeze-Dried Raw Dog Food 48 oz (3 Bags x 16 oz)		0107BIIMRIV	6M-ZGFE-KKNT	99.99		2024-01-07 02:59:53 PST		y	1			11				B0BB4PJF5K						B0BB4PJF5K				AMAZON_NA	Migrated Template	Active
Loving Pets, Corp. Rawhide Compressed Bone 8.5in		0314BWCRIJW	6O-JW5J-FM8V	7.15		2024-03-14 12:57:21 PDT		y	1			11				B0017RJEQQ						B0017RJEQQ				AMAZON_NA	Migrated Template	Active
Liqui Moly 20010 85W-90 GL-5 High Pressure Gear Oil - 1 L		0315BYUAHX6	6S-C08H-ME8Z	21.7		2024-03-15 08:43:22 PDT		y	1			11				B001NFC1BM						B001NFC1BM				AMAZON_NA	Migrated Template	Active
All Purpose Animal Nu-Stock Ointment Stops Itching Immediately, 12 Oz. tube		0223BGLFLPN	6X-MCAP-3ITO	26.45		2024-02-23 12:35:54 PST		y	1			11				B07D3QQJK5						B07D3QQJK5				AMAZON_NA	Migrated Template	Active
Sea Breeze Astringent Original Formula, Classic Clean 10 oz by Seabreeze		0112BX000IH	71-W11W-NKTT	8		2024-01-12 11:14:21 PST		y	1			11				B01MR3FBQN						B01MR3FBQN				AMAZON_NA	Migrated Template	Active
Durham's 076694000015 1-Pound Rockhard Water Putty		1204A63TEOI	73-4T42-413J	8.5		2023-12-04 10:48:08 PST		y	1			11				B01M12E5XN						B01M12E5XN				AMAZON_NA	Migrated Template	Active
Supreme Petfoods 3 Pack of Selective Naturals Meadow Loops, 2.8 Ounces each, with Timothy Hay and Thyme		0126BUWWPG4	7D-TM45-S4FP	15.8		2024-01-26 08:19:11 PST		y	1			11				B07SJVR8RB						B07SJVR8RB				AMAZON_NA	Migrated Template	Active
Kaytee Chew-Proof Water Bottle for Pet Hamsters, Gerbils and Rats, 6 oz		0314BWFZBVL	7I-GKTI-6FCQ	9.5		2024-03-14 12:54:48 PDT		y	1			11				B000HHSBXY						B000HHSBXY				AMAZON_NA	Migrated Template	Active
Greenies Bundle Pack Pill Pocket Tablet for Dogs (3 Pack) Flavored Dog Treats (90 Tablets) Bundle Dental Treats		0104BC93YAH	7K-CS27-R46F	24.8		2024-01-04 11:49:17 PST		y	1			11				B0BL8YT42N						B0BL8YT42N				AMAZON_NA	Migrated Template	Active
Redbarn Grain Free 3lb Dog Food Roll - Chicken (1-Count)		0326BR51413	7L-E844-BJ9L	20.99		2024-03-26 14:19:14 PDT		y	1			11				B018LBPCQ6						B018LBPCQ6				AMAZON_NA	Migrated Template	Active
Nature Zone SNZ59231 Appetite Plus Reptile Concentrated Solution, 2-Ounce		0314BWE3VJ8	7L-HPDN-UVKU	9.34		2024-03-14 13:00:29 PDT		y	1			11				B0002ARSJO						B0002ARSJO				AMAZON_NA	Migrated Template	Active
Sheba Perfect Portions Savory Mixed Grill Entree` Cuts in Gravy (5-2 Pack Trays)		0712AG62PFV	7N-4TH4-QC5Z	13.9		2023-07-12 07:09:55 PDT		y	1			11				B01MDM1CPJ						B01MDM1CPJ				AMAZON_NA	Migrated Template	Active
Redbarn Bully Slices for Dogs | Highly Palatable, Long-Lasting Natural Dental Treats with Functional Ingredients, 9 oz. (Pack of 3) - Peanut Butter		0124BPMP1WC	7T-TIJ5-A25V	34.8		2024-01-24 10:34:57 PST		y	1			11				B073ZLLZ6Q						B073ZLLZ6Q				AMAZON_NA	Migrated Template	Active
Rooster Booster Vitamins and Electrolytes with Lactobacillus, Natural, 8 oz.		0905ALXI1KX	7V-FGEZ-PFAD	14.5		2023-09-05 13:22:20 PDT		y	1			11				B00KMNTYHK						B00KMNTYHK				AMAZON_NA	Migrated Template	Active
Unrefined Smoked Salmon with Ancient Grains & Superfoods Dry Dog & Puppy Food		0307BDG81FH	7W-XRI9-G3GB	29.1		2024-03-07 14:17:06 PST		y	1			11				B07XQXNN7L						B07XQXNN7L				AMAZON_NA	Migrated Template	Active
Hikari USA Inc. Ich x - Ich Treatment with More 16oz		1101AU2GJ9H	80-QT1J-TAW1	18.07		2023-11-01 11:25:50 PDT		y	1			11				B00176I3UA						B00176I3UA				AMAZON_NA	Migrated Template	Active
250Ml, Paraguard Parasite Control		0318B5JVUEU	8G-AKU1-CSBZ	13.2		2024-03-18 06:24:12 PDT		y	1			11				B01D03CCW2						B01D03CCW2				AMAZON_NA	Migrated Template	Active
Ear Tag Marking Pen, Black		0319B8HPQZK	8L-IQ3C-UULN	12.4		2024-03-19 06:35:29 PDT		y	1			11				B000HHM5GI						B000HHM5GI				AMAZON_NA	Migrated Template	Active
Grannick's Bitter Apple Taste Deterrent Spray Bottle for Dogs, 8 Ounces, Single		0404BD2HD2V	8Q-067T-GGSY	16.34		2024-04-03 19:31:17 PDT		y	1			11				B001CCNG88						B001CCNG88				AMAZON_NA	Migrated Template	Active
Gold Bond Extra Strength 14oz Medicated Body Lotion for Dry & Itchy Skin (Pack of 2)		0908AUK7M63	8V-ITPI-GJJ5	30.99		2023-09-08 09:25:14 PDT		y	1			11				B00FMQBJW0						B00FMQBJW0				AMAZON_NA	Migrated Template	Active
Red Sea Aqcult 306168 1 LTR Reefer Foundation B Alkalin		0918AKTYYXX	8V-X8GU-OIL4	27.5		2023-09-18 07:39:53 PDT		y	1			11				B074MLFHS7						B074MLFHS7				AMAZON_NA	Migrated Template	Active
Promotion Plus Omegas Soft Chews Medium Large Dogs (90 ct)		1101AU4OSS5	92-NJMQ-SOZK	49.99		2023-11-01 10:40:19 PDT		y	1			11				B007FPNK9G						B007FPNK9G				AMAZON_NA	Migrated Template	Active
Visine Original Redness Reliever Eye Drops - 0.5 oz, Pack of 2		1004AR5PMON	93-LZOG-635S	15.99		2023-10-04 08:55:55 PDT		y	1			11				B073V3HC5B						B073V3HC5B				AMAZON_NA	Migrated Template	Active
Dr. Tim`s Aquatics Waste-Away Saltwater 8 Oz		0411A2VBWRG	96-FNYJ-GQO2	14.8		2023-04-11 08:09:27 PDT		y	1			11				B002DGVYZO						B002DGVYZO				AMAZON_NA	Migrated Template	Active
VetOne CeraDerm Aloe & Oatmeal Conditioning Shampoo 16 oz		1220ADJI650	9C-XUKK-HR1K	13.5		2023-12-20 05:44:50 PST		y	1			11				B09RJN3DDC						B09RJN3DDC				AMAZON_NA	Migrated Template	Active
TRESemmé Expert Selection Heat Protection Spray, Keratin Smooth, 8 Fl Oz ,(Pack of 3)		1207AEFNDUS	9H-FMRI-QA6B	13.99		2023-12-07 09:06:57 PST		y	1			11				B00KAR9SHE						B00KAR9SHE				AMAZON_NA	Migrated Template	Active
ZuPreem Natural Pellets Bird Food for Medium Birds, 2.5 lb (Pack of 2) - Daily Nutrition, Made in USA for Cockatiels, Quakers, Lovebirds, Small Conures		0828AZODC4T	9H-GMPI-2UC4	28.2		2023-08-28 14:16:55 PDT		y	1			11				B07D267L8M						B07D267L8M				AMAZON_NA	Migrated Template	Active
LAFEBER'S Nutri-Berries Parakeet, Cockatiel, Lovebird & Conure Food 2 Flavor Variety Bundle, (1) Each: Papaya Pineapple Mango, Cranberries Apricots Dates, 10 Ounces		0105BF37GPR	9K-JDHJ-LYE8	25.99		2024-01-05 14:44:14 PST		y	1			11				B01N1579YI						B01N1579YI				AMAZON_NA	Migrated Template	Active
Vet Plus 180 Count Probios Digestive Dog Tablet		0905ALXJEPU	9L-ONXS-PHIM	49.5		2023-09-05 13:22:05 PDT		y	1			11				B001KYNZRA						B001KYNZRA				AMAZON_NA	Migrated Template	Active
Seventh Generation -5703 Wipe Baby Refill (Pack of 12)		0304B4I0APW	9P-ZKZU-YEC5	54.99		2024-03-04 13:05:09 PST		y	1			11				B00BDJTXUA						B00BDJTXUA				AMAZON_NA	Migrated Template	Active
CaribSea Purple Up Algae Accelerator, 8-Ounce		0517A1R6ZAA	9U-1196-5U5H	11.47		2023-05-17 06:52:46 PDT		y	1			11				B000I2RNU0						B000I2RNU0				AMAZON_NA	Migrated Template	Active
Charlee Bear Crunch Turkey, Sweet Potato & Cranberry Flavor Dog Treat and Snack (2 Pack) 8 oz Each		0724AEFEOW8	A3-67YU-30WG	16.47		2023-07-24 13:36:11 PDT		y	1			11				B077ZM1KF3						B077ZM1KF3				AMAZON_NA	Migrated Template	Active
Pyranha Elite E3 Hair 16 oz Growth Equine Horse Dog Mane Tail Growth Stimulant Shampoo		0223BGDS4DG	A6-W6PA-9JDX	17.99		2024-02-23 12:31:27 PST		y	1			11				B07QLGHRTD						B07QLGHRTD				AMAZON_NA	Migrated Template	Active
Derma3 Large Breed Softgels 60 ct		0204BEXUO5I	A7-7UR5-U3MQ	22.43		2024-02-04 12:47:33 PST		y	1			11				B003OD5M4Y						B003OD5M4Y				AMAZON_NA	Migrated Template	Active
GeriCare Ferrous Sulfate Tablets 325mg, Elemental Iron 65 mg High Potency Iron Supplement | No Artificial Color Additives Dietary Supplement 100 Count. (Pack of 1)		0318B5R7O9S	A7-WHEX-T9TM	5.18		2024-03-18 06:24:43 PDT		y	1			11				B004V4HQ8A						B004V4HQ8A				AMAZON_NA	Migrated Template	Active
Redbarn Filled Dog Bones | Natural Long-Lasting Dental Treats; Suitable for Aggressive Chewers | Large (6") - 5 Bones (Peanut Butter)		1009A4N2AIW	AM-N54N-MQ56	38.99		2023-10-09 07:44:44 PDT		y	1			11				B00UPCFD8C						B00UPCFD8C				AMAZON_NA	Migrated Template	Active
Ceva Derma-3 Liquid, Omega-3 Fatty Acid & Vitamin Supplement for Dogs & Cats (8 oz.)		1101AU43EF4	AX-KSQS-VSOO	23.99		2023-11-01 10:40:53 PDT		y	1			11				B07B16H83F						B07B16H83F				AMAZON_NA	Migrated Template	Active
Teknor Apex Neverkink 8844-75 PRO Water Hose, 5/8-in x 75-feet		0411A2YF4GL	AZ-IY8Q-1PIU	62.99		2023-04-11 08:16:12 PDT		y	1			11				B00INTILWE						B00INTILWE				AMAZON_NA	Migrated Template	Active
Motul Gear 300 75w90 100 Percent Synthetic Gear Oil 1 Liter (105777)		0315BYYAZ90	B0-AU6W-Z2AU	24.5		2024-03-15 08:43:46 PDT		y	1			11				B005UGKJCS						B005UGKJCS				AMAZON_NA	Migrated Template	Active
Nipro Diagnostics True Metrix Medi NFRs Blood Glucose Test Strips(150 Count)		0107BIGZQ8W	B5-8J7P-AEQA	36.99		2024-01-07 02:59:53 PST		y	1			11				B0194CO8TS						B0194CO8TS				AMAZON_NA	Migrated Template	Active
Higgins Pet Food Intune Ferret 4Lb		0220B8TKTYM	B6-56CE-GV4B	24.23		2024-02-20 08:55:17 PST		y	1			11				B07PHKJTNV						B07PHKJTNV				AMAZON_NA	Migrated Template	Active
Higgins 18 Count Spray Millet, Natural Treats for All Pet and Wild Birds		0220B8RQMGE	BK-T1HL-UVF2	15.99		2024-02-20 08:54:52 PST		y	1			11				B07P8WYM7P						B07P8WYM7P				AMAZON_NA	Migrated Template	Active
Pretty Bird International Bpb73117 3-Pound Daily Select Premium Bird Food, Medium		0313BRXV24D	BN-HVRK-SG7K	19.99		2024-03-13 09:19:10 PDT		y	1			11				B0006G5M0G						B0006G5M0G				AMAZON_NA	Migrated Template	Active
Fieldcrest Farms 3 Pack of Nothin' to Hide Beef Rings and Bones, 12 Count Each, Rawhide Alternative Dog Chews		0318B6BD09R	BQ-2GUH-LNFA	19.72		2024-03-18 11:45:45 PDT		y	1			11				B08GKZYZT2						B08GKZYZT2				AMAZON_NA	Migrated Template	Active
Febreze Plug in Air Fresheners, Limited Edition Winter Spruce Scent, Scented Oil Refill (2 Count)		0206BJKF8XP	BR-YI02-G1GK	14.4		2024-02-06 09:27:52 PST		y	1			11				B0BNW9GNZB						B0BNW9GNZB				AMAZON_NA	Migrated Template	Active
Huggies Natural Care Fragrance Free Baby Wipes, 112 Total Wipes 56 Count Each (Pack of 2)		0213AEH9VRN	BRANDNAME-7	8.9		2023-02-13 10:05:26 PST		y	1			11				B01IE43CVC						B01IE43CVC				AMAZON_NA	Migrated Template	Active
YEOWWW! DuckyWorld 100% ORGANIC CATNIP Leaf & Flower Cat Toy BANANA 3 PACK		1009A58JXHL	BV-LADJ-PBFK	19.5		2023-10-09 13:40:45 PDT		y	1			11				B01N5QG9EX						B01N5QG9EX				AMAZON_NA	Migrated Template	Active
Dr. Marty Nature's Blend Freeze-Dried Raw Dog Food 18 oz (3 Bags x 6 oz), LFCNE		0227BOQDG5S	BW-6XBN-8Y2G	43.99		2024-02-27 10:23:50 PST		y	1			11				B0BLLZCDCY						B0BLLZCDCY				AMAZON_NA	Migrated Template	Active
Starbar QuikStrike Fly Abatement Strip		1011ZUQ8528	BWI-63	26.99		2022-10-11 11:17:54 PDT		y	1			11				B0071DOVKE						B0071DOVKE				AMAZON_NA	Migrated Template	Active
ZuPreem FruitBlend Flavor Pellets Bird Food for Large Birds, 3.5 lb (2-Pack) - Daily Blend Made in USA for Amazons, Macaws, Cockatoos		0828AZTWJJZ	BX-7QLK-Z79S	37.5		2023-08-28 14:18:29 PDT		y	1			11				B07K77YZFT						B07K77YZFT				AMAZON_NA	Migrated Template	Active
vetone DuoClenz Enzyme Coated Dental Chews for Medium Size Dogs 30 Count		1201AZPB9O2	BY-UXKX-HIJ2	16.8		2023-12-01 07:23:23 PST		y	1			11				B00C8RJ3BA						B00C8RJ3BA				AMAZON_NA	Migrated Template	Active
Higgins 2 Pack of Vita Seed Natural Blend Cockatiel Food, 2.5 Pounds Each		0220B8WHUJM	C7-1ZR5-9NIL	19.79		2024-02-20 08:54:20 PST		y	1			11				B07GV2S79T						B07GV2S79T				AMAZON_NA	Migrated Template	Active
Redbarn Bully Slices for Dogs | Highly Palatable, Long-Lasting Natural Dental Treats with Functional Ingredients, 9 oz. (Pack of 2) - Original Bully		1226AR0750V	C8-8BB1-HFXH	25.07		2023-12-26 10:11:28 PST		y	1			11				B07Z9JMW91						B07Z9JMW91				AMAZON_NA	Migrated Template	Active
Corona Horseman's Dream Vet Cream Jar Horse Minor Wounds Skin Soothe Conditions, 16 oz		0129B19BVKJ	C8-Y99W-UTKB	30.99		2024-01-29 09:09:46 PST		y	1			11				B00JAKY7WI						B00JAKY7WI				AMAZON_NA	Migrated Template	Active
ZuPreem Natural Pellets Bird Food for Small Birds, 2.25 lb (Pack of 2) - Made in USA, Essential Nutrition for Parakeets, Budgies, Parrotlets		0828AZRP37H	CA-HU0J-7D3D	25.99		2023-08-28 14:18:16 PDT		y	1			11				B06XYNS5X6						B06XYNS5X6				AMAZON_NA	Migrated Template	Active
MAXI/GUARD Dental Cleansing Wipes for Dogs, Cats, Horses and Companion Animals (100 Wipes), Light Blue/White		1101AU4DGVA	CE-DU2D-9AEI	22.5		2023-11-01 10:42:34 PDT		y	1			11				B08DG796BW						B08DG796BW				AMAZON_NA	Migrated Template	Active
Ocean Nutrition Brine Shrimp Plus Flake Fish Food 5.5 Ounces (154 Grams) Jar | Freshwater & Saltwater Marine Aquarium Flakes Food for Aquariums		1206ZPV8CN7	CENTRAL-65	18.99		2022-12-06 11:31:18 PST		y	1			11				B00025Z6XE						B00025Z6XE				AMAZON_NA	Migrated Template	Active
Bergan 70128 16" X 1.88" Turbo Scratcher Cat Toy Assorted Colors		1207ZSCK5HC	CENTRAL-67	26.5		2022-12-07 07:27:40 PST		y	1			11				B00O8PTF36						B00O8PTF36				AMAZON_NA	Migrated Template	Active
Espree Vanilla Silk Conditioning Cologne, 4 oz		0118ALGWG9K	CENTRAL-70	8.6		2023-01-18 06:59:25 PST		y	1			11				B01EZUGGE4						B01EZUGGE4				AMAZON_NA	Migrated Template	Active
Redbarn All-Natural Air Dried Chicken Training Treats for Puppies & Dogs – Grain-Free Single Protein Rewards Made in USA for Small, Medium, & Large Breeds - 8 oz Resealable Bag		0425A9P7TVQ	CENTRAL-74	8.25		2023-04-25 06:18:32 PDT		y	1			11				B07WSFXZDK						B07WSFXZDK				AMAZON_NA	Migrated Template	Active
