item-name	item-description	listing-id	seller-sku	price	quantity	open-date	image-url	item-is-marketplace	product-id-type	zshop-shipping-fee	item-note	item-condition	zshop-category1	zshop-browse-path	zshop-storefront-feature	asin1	asin2	asin3	will-ship-internationally	expedited-shipping	zshop-boldface	product-id	bid-for-featured-placement	add-delete	pending-quantity	fulfillment-channel	merchant-shipping-group	status
Redbarn Protein Puffs for Dogs | High-Protein Training Treat or Food Topper | Made in The USA (Peanut Butter, Pack of 3)		0119BDUL34V	CY-TY57-MY4B	20.99		2024-01-19 11:55:42 PST		y	1			11				B086L32NCC						B086L32NCC				AMAZON_NA	Migrated Template	Inactive
N-Bone Puppy Teething Treats		0330A1PZ52X	CZ-9JI2-WZFR	13.99		2023-03-30 13:12:47 PDT		y	1			11				B00IELRTNI						B00IELRTNI				AMAZON_NA	Migrated Template	Inactive
Degree Men Deodorant, Intense Sport 3 oz (Pack of 4)		0927AAIC3HL	CZ-DB12-DVJO	22.99		2023-09-27 12:45:37 PDT		y	1			11				B06Y1QN5LX						B06Y1QN5LX				AMAZON_NA	Migrated Template	Inactive
Hikari 2.2-Pound Sinking Cichlid Gold Pellets for Pets, Medium		0423BXX43F6	D0-OKCV-V24O	31.95		2024-04-23 06:08:38 PDT		y	1			11				B002CTH5NW						B002CTH5NW				AMAZON_NA	Migrated Template	Inactive
MAHLE (OC 306) Original Oil Filter		0423BXRHJLU	D2-6WYJ-RHJW	19.4		2024-04-23 06:06:34 PDT		y	1			11				B0068OBVN2						B0068OBVN2				AMAZON_NA	Migrated Template	Inactive
Natural Chemistry Clean & Perfect 24 oz. Spray Bottle		0418BJ0HSUE	D2-KJES-UKHG	18.99		2024-04-18 06:53:26 PDT		y	1			11				B002WKQ26C						B002WKQ26C				AMAZON_NA	Migrated Template	Inactive
Dettol Anti-Bacterial Bar Soap, Skincare, 110 Gr / 3.88 Oz (Pack of 12)		1012ADIUJ2Z	D2-N0B4-E6FK	16.99		2023-10-12 10:40:37 PDT		y	1			11				B00JDWI9TU						B00JDWI9TU				AMAZON_NA	Migrated Template	Inactive
Fertilome (10363) Fire Blight Spray (2oz)		0410BV72LL9	D4-MNBW-29HA	18.99		2024-04-10 07:06:28 PDT		y	1			11				B00KGH107O						B00KGH107O				AMAZON_NA	Migrated Template	Inactive
Liqui Moly 20004 Hydraulic Lifter Addtive (2 Pack)		0409BRTAXPO	D5-BYNK-VNUI	23.1		2024-04-09 06:07:53 PDT		y	1			11				B0725BXPCV						B0725BXPCV				AMAZON_NA	Migrated Template	Inactive
Sogeval Douxo Micellar Ear Cleansing Solution for Pets, 8.4-Ounce		1101AU4DZNU	D5-W8RL-QOQS	27.99		2023-11-01 10:40:38 PDT		y	1			11				B07B16DDMG						B07B16DDMG				AMAZON_NA	Migrated Template	Inactive
Vital Essentials Vital CAT Chicken Breast Freeze-Dried Cat Treats - All Natural Raw Treat - Made & Sourced in USA - Grain Free - 1 oz Resealable Pouch - 3 Pack		1025ABIFRZF	D7-31OJ-OVGI	25.98		2023-10-25 12:18:41 PDT		y	1			11				B07P97MNWJ						B07P97MNWJ				AMAZON_NA	Migrated Template	Inactive
Vaseline Lotion Bundle, Cocoa Shimmer Jelly Stick Highlighter & Luminizer + All Over Body Balm Stick, Cocoa Butter, Body Balm Skin Care Set, Petroleum Jelly for Dry Skin (4 Piece Set)		0301BWW6ZMJ	DA-9UD4-ZKCU	24.99		2024-03-01 11:27:14 PST		y	1			11				B0CLM7TK7M						B0CLM7TK7M				AMAZON_NA	Migrated Template	Inactive
GUM Technique Deep Clean Toothbrush - Compact Soft - Soft Toothbrushes for Adults with Sensitive Gums - Extra Fine Bristles, 1ct (12pk)		0403U6AL5JE	DARBY-$10.60	15		2018-04-03 09:16:51 PDT		y	1			11				B07V33WDGD						B07V33WDGD				AMAZON_NA	Migrated Template	Inactive
Marble Retainer Cases, Assorted Colors, Pack of 6		1218UV05YSH	DARBY-20	14.99		2018-12-18 09:52:29 PST		y	1			11				B078KFMFV8						B078KFMFV8				AMAZON_NA	Migrated Template	Inactive
GUM Red-Cote Disclosing Plaque Tablets- Cherry Flavor (40 tablets)		0610V4CT50E	DARBY-21	10.99		2019-06-10 15:02:12 PDT		y	1			11				B001BJQGES						B001BJQGES				AMAZON_NA	Migrated Template	Inactive
Designer Marbled Retainer Cases, Assorted, Pack of 6		0730V1WYR03	DARBY-24	15.99		2019-07-30 09:01:16 PDT		y	1			11				B07D2JTHPR						B07D2JTHPR				AMAZON_NA	Migrated Template	Inactive
Crest Whitestrips Supreme (7x) (7)		0813VQZ5ZOA	DARBY-26	25		2019-08-13 07:36:51 PDT		y	1			11				B00C6Z8AJ0						B00C6Z8AJ0				AMAZON_NA	Migrated Template	Inactive
Proxysoft Dental Floss for Bridges and Implants 6 Packs - Floss Threaders for Bridges, Dental Implants, Braces with Extra-Thick Proxy Brush for Optimal Oral Hygiene -Teeth Bridge and Implant Cleaners		0928VTQ1VNQ	DARBY-27	34.99		2019-09-28 09:50:37 PDT		y	1			11				B0187Q4TC8						B0187Q4TC8				AMAZON_NA	Migrated Template	Inactive
Proxysoft Dental Floss for Bridges and Implants 5 Packs - Floss Threaders for Bridges, Dental Implants, Braces with Extra-Thick Proxy Brush for Optimal Oral Hygiene -Teeth Bridge and Implant Cleaners		0928VTP40SX	DARBY-28	32.99		2019-09-28 09:54:27 PDT		y	1			11				B01D3O3JC0						B01D3O3JC0				AMAZON_NA	Migrated Template	Inactive
Practicon Marble Retainer Cases, Orthodontic Aligner Case, Mouth Guard Holder (3 Pack) (Assorted)		1202V686GGM	DARBY-29	10.99		2019-12-02 14:23:43 PST		y	1			11				B07S25JSMF						B07S25JSMF				AMAZON_NA	Migrated Template	Inactive
Dental Floss for Bridges and Dental Implants for Optimal Oral Hygiene - Floss Threaders for Bridges and Implants with Extra-Thick Proxy Brush - Bridge and Implant Cleaners (30 Strands) by ProxySoft		1209VNC52QR	DARBY-30	10		2019-12-09 07:09:58 PST		y	1			11				B009L12MLO						B009L12MLO				AMAZON_NA	Migrated Template	Inactive
Red-cote Dental Disclosing Tablets - Cherry Flavor 248 Package Tablet, by Sunstar Americas, Inc		0212XN7M55Y	DARBY-32	34.99		2020-02-12 08:03:05 PST		y	1			11				B00589UFBC						B00589UFBC				AMAZON_NA	Migrated Template	Inactive
PREPARATION H Hemorrhoid Symptom Treatment Suppositories, Burning, Itching and Discomfort Relief (48 Count)		1220ADEFKQH	DB-FQLJ-CFPP	47		2023-12-20 05:44:48 PST		y	1			11				B0753B3BK5						B0753B3BK5				AMAZON_NA	Migrated Template	Inactive
C.E.T. Enzymatic Oral Hygiene Chews for Petite Dogs, 90 Count		0724AE3MT2F	DC-5LKP-PAKC	52.99		2023-07-24 10:41:01 PDT		y	1			11				B00J5ZUJW0						B00J5ZUJW0				AMAZON_NA	Migrated Template	Inactive
After Bite Xtra Insect Bite Treatment with Antihistamine – Strong Itch Relief for Extra Itchy Bug Bites,Multi,0006-1270		1004AR5US6O	DE-LX7A-4HN2	9.99		2023-10-04 09:02:57 PDT		y	1			11				B001G7QVH2						B001G7QVH2				AMAZON_NA	Migrated Template	Inactive
Phillips' Milk of Magnesia Liquid Wild Cherry - 12 oz, Pack of 3		0927AA56IHI	DF-FG85-GTHE	14.94		2023-09-27 08:56:27 PDT		y	1			11				B07D8356SK						B07D8356SK				AMAZON_NA	Migrated Template	Inactive
Greenies 4 Pack Of Peanut Butter Flavor Pill Pockets for Dogs, Approximately 30 Pockets Per Pack		0314BVXKV37	DF-N29H-Y9UJ	34.99		2024-03-14 07:38:31 PDT		y	1			11				B01A5TFCRG						B01A5TFCRG				AMAZON_NA	Migrated Template	Inactive
DIA02795 - Dial Pomegranate Antibacterial Hand Soap - 6 Pack		0107BJ3Q07W	DF-YMYT-D75Y	19.06		2024-01-07 15:46:19 PST		y	1			11				B0141NTJ3A						B0141NTJ3A				AMAZON_NA	Migrated Template	Inactive
Dorco Tinkle Eyebrow Razor, Hair Trimmer Shaper Shaver and Tough Up Tool, Facial Razor with Safety Cover, 3 Razors To Remove The Fine Hairs Dermaplane Razor | Holiday Stocking Stuffers		0108BKRL40E	DH-Q3PN-V19N	3		2024-01-08 06:19:11 PST		y	1			11				B00JA1AHRG						B00JA1AHRG				AMAZON_NA	Migrated Template	Inactive
Dickinson’s Original Witch Hazel Pore Perfecting Toner 16 oz		0102V20B7AO	DICK	14.99		2019-01-02 12:24:17 PST		y	1			11				B000GCQ056						B000GCQ056				AMAZON_NA	Migrated Template	Inactive
T.N. Dickinson's Witch Hazel 100% Natural Astringent for Face and Body, 8 fl oz		0102V1ZL15O	DICK-3	10		2019-01-02 12:32:56 PST		y	1			11				B000VV0E90						B000VV0E90				AMAZON_NA	Migrated Template	Inactive
Dickinson Brands Hazelet Witch Hazel Pad, 60 Count, (Pack of 2)		0403XYT0H2P	DICK-5	15.99		2020-04-03 11:44:15 PDT		y	1			11				B00KPTKK9W						B00KPTKK9W				AMAZON_NA	Migrated Template	Inactive
Dickinson's Witch Hazel Astringent, 16 Ounce		0411XFRBRFX	DICK-6	15.99	0	2020-04-11 06:00:55 PDT		y	1			11				B00G4EIDXC						B00G4EIDXC			0	DEFAULT	WItch Hazel 16 oz Template	Inactive
Dickinson's Witch Hazel All Natural Astringent 8 oz (Pack of 4)		0514XS06K9Z	DICK-7	25.99		2020-05-14 07:48:07 PDT		y	1			11				B01BS56A1I						B01BS56A1I				AMAZON_NA	WItch Hazel 16 oz Template	Inactive
Monterey 8oz Garden Insect Spray Spinosad		1204A62KMD5	DJ-6XIM-1H6O	29.99		2023-12-04 10:27:01 PST		y	1			11				B01N5P7UW8						B01N5P7UW8				AMAZON_NA	Migrated Template	Inactive
Redbarn All-Natural Protein Puffs Crunchy Treats for Cats and Kittens, Salmon Flavor - Premium Grain-Free High Protein Low Fat Snack - Made in USA with No Artificial Ingredients - 1.8 oz Bag		1018ARZSFGU	DK-SWE0-Z5R2	10		2023-10-18 07:18:53 PDT		y	1			11				B07G994H7V						B07G994H7V				AMAZON_NA	Migrated Template	Inactive
Durvet No Pick'n for Chickens		1220ADEHC1V	DN-WIR1-VGSV	15		2023-12-20 05:44:49 PST		y	1			11				B0BGSG4BGX						B0BGSG4BGX				AMAZON_NA	Migrated Template	Inactive
ATE Original SL DOT 4 Brake Fluid, 1 Liter Can (705802)		0422BSO0LCA	DP-ZR4R-O0T2	27.74		2024-04-21 19:34:53 PDT		y	1			11				B001BAWG6O						B001BAWG6O				AMAZON_NA	Migrated Template	Inactive
CEVA Animal Health Breakables Clenz-A-Dent Rawhide Dental Chews for Dogs, Medium/Large/11-50 lb/15 Count		0204BF0VQTE	DQ-H2J5-JAZB	21.99		2024-02-04 12:47:03 PST		y	1			11				B07G2FK86Z						B07G2FK86Z				AMAZON_NA	Migrated Template	Inactive
Sapporo Noodle Ichiban Chckn		0411A2N420E	DR-YPKE-Q85V	20.99		2023-04-11 08:11:41 PDT		y	1			11				B00886HZ42						B00886HZ42				AMAZON_NA	Migrated Template	Inactive
Triple Paste Medicated Ointment for Diaper Rash, Hypoallergenic - 2 oz (Pack of 1)		1004ARA8U91	DS-6R99-GJF7	15.99		2023-10-04 08:52:37 PDT		y	1			11				B00E5QX2HI						B00E5QX2HI				AMAZON_NA	Migrated Template	Inactive
Dr. Marty Nature's Blend Freeze Dried Raw Dog Food, 6 oz		0829A3E4LI4	DS-TWXF-3M7K	24.99		2023-08-29 13:00:19 PDT		y	1			11				B08P8Z8WN7						B08P8Z8WN7				AMAZON_NA	Migrated Template	Inactive
Unilever Vaseline Cocoa Shimmer Jelly Stick GLOW UP Body Luminizer For Dewy Radiant Skin 1.4 oz - 3 Count		0301BWUO9U2	DU-I3XU-OS32	21.99		2024-03-01 11:27:24 PST		y	1			11				B0B18YXF8S						B0B18YXF8S				AMAZON_NA	Migrated Template	Inactive
Indigo Wild Zum Clean Laundry Soap, Frankincense and Myrrh, 32 Fluid Ounce		0411A2JIZRS	DU-M1NP-FM2Y	24.99		2023-04-11 08:11:33 PDT		y	1			11				B00F99VIUS						B00F99VIUS				AMAZON_NA	Migrated Template	Inactive
Advanced Cetyl M Dog Joint Action Tablets 360 Count		0905ALQJUJT	DV-KW7C-8T1Y	127.34		2023-09-05 13:23:21 PDT		y	1			11				B076HNT7KC						B076HNT7KC				AMAZON_NA	Migrated Template	Inactive
Dove Nourishing Secrets Body Wash, Glowing Ritual Lotus Flower - 750 ML / 25.36 Fl Oz (Pack of 3)3		1010A85F8LL	DY-PQ5S-QEOK	26.99		2023-10-10 13:50:39 PDT		y	1			11				B0848TBRW9						B0848TBRW9				AMAZON_NA	Migrated Template	Inactive
Mr. Bubble Liquid Bubble Bath, Original 16 oz (Pack of 7)		0415B9JV1SE	DZ-2UUH-PNPX	38.03		2024-04-15 12:16:15 PDT		y	1			11				B01IAFFZD8						B01IAFFZD8				AMAZON_NA	Migrated Template	Inactive
Miracle-GRO Indoor Plant Food, 48-Spikes (3-Pack (48 Count))		1030ANPPL6Z	E0-8LJQ-P4ZK	11.99		2023-10-30 06:20:59 PDT		y	1			11				B07GD89HVK						B07GD89HVK				AMAZON_NA	Migrated Template	Inactive
Lysol All-Purpose Cleaner - Spray - 32 fl oz (1 quart) - Lemon Scent - Yellow		1010A841P0X	E1-KZOK-A0N8	15.99		2023-10-10 13:51:27 PDT		y	1			11				B0090YGZVK						B0090YGZVK				AMAZON_NA	Migrated Template	Inactive
Canophera Coffee Wood Dog chew Sticks for Regular chewers - Size Large		0915AEN9HM8	E2-2WYJ-JT86	20.99		2023-09-15 15:05:49 PDT		y	1			11				B09TL2LNDQ						B09TL2LNDQ				AMAZON_NA	Migrated Template	Inactive
Zoo Med Can O' Snails Turtle Food, 1.7-Ounce (Pack of 3)		0401B5PRJUH	E2-LGAZ-NA9H	22.7		2024-04-01 10:19:30 PDT		y	1			11				B00TO0CLT0						B00TO0CLT0				AMAZON_NA	Migrated Template	Inactive
Pure Water Pebbles Aquarium Gravel, 5-Pound, Midnight Glo		0313BS3G55E	E7-9EXH-8RYU	13.66		2024-03-13 09:18:46 PDT		y	1			11				B00F8DWBCO						B00F8DWBCO				AMAZON_NA	Migrated Template	Inactive
Greenies Treats for DogsMini Treat-Pak-Petite 6 oz		0314BVYDO3K	E8-8WWO-EHV6	18.99		2024-03-14 07:38:02 PDT		y	1			11				B01A5TQ89C						B01A5TQ89C				AMAZON_NA	Migrated Template	Inactive
Old Spice TRTAZ11A Solid Deodorant, Pure Sport, 2.25oz, Pack of 6		0415B9A88ZZ	E9-6SOP-T760	24.99		2024-04-15 09:49:23 PDT		y	1			11				B00FL8R4HS						B00FL8R4HS				AMAZON_NA	Migrated Template	Inactive
OxiClean Laundry Stain Remover Spray, 21.5 fl oz		0422BUTYYRW	EA-BSFM-BAOS	11.2		2024-04-22 07:17:09 PDT		y	1			11				B001B181G2						B001B181G2				AMAZON_NA	Migrated Template	Inactive
Ivermectin Paste - Horse Wormer 6.08 Grams (3-Pack) + TL Bundles Sticker Included		0129B19JDYL	EC-E046-J97I	38.99		2024-01-29 09:10:38 PST		y	1			11				B0CM9Q9WHZ						B0CM9Q9WHZ				AMAZON_NA	Migrated Template	Inactive
Grannicks Bitter Apple 8oz w/Sprayer-2 pack		0409BRXIW1A	EC-IQLX-GQT6	19.84		2024-04-09 06:57:45 PDT		y	1			11				B00HVLJYVW						B00HVLJYVW				AMAZON_NA	Migrated Template	Inactive
Calmoseptine Ointment 4 oz (Pack of 4)		0108BKOTCAZ	EC-YTCP-9MBR	32.99		2024-01-08 05:28:02 PST		y	1			11				B01JMHLNZM						B01JMHLNZM				AMAZON_NA	Migrated Template	Inactive
Temptations Classic Treats For Cats Tasty Chicken Flavor 6.3 Ounces		0206BJSK17T	ED-RGB4-DHML	8		2024-02-06 11:54:35 PST		y	1			11				B005H3AVX6						B005H3AVX6				AMAZON_NA	Migrated Template	Inactive
AquaIllumination Prime 16 HD LED Saltwater Reef Aquarium Light - Black		0402B9711LM	ED-S8EP-1MV1	269.99		2024-04-02 13:50:35 PDT		y	1			11				B0CVZ1WGN5						B0CVZ1WGN5				AMAZON_NA	Migrated Template	Inactive
Higgins 2 Pack Safflower Gold Natural Conure & Cockatiel Food. 3 LBS. Ea Safflower Gold Natural Conure & Cockatiel Food. 2 Bags 6 Pounds Total.		0828AZOJW8E	EF-0T50-DQGB	27.48		2023-08-28 14:47:47 PDT		y	1			11				B07GV228R3						B07GV228R3				AMAZON_NA	Migrated Template	Inactive
Plink Bin Fresh Odor Eliminators, Fresh Lemon Scent, for Garbage Bins & More, Lasting Freshness up to 30 Days, 6-Count		0829A3J82SR	EG-HZQY-JT2Q	15.99		2023-08-29 12:42:04 PDT		y	1			11				B07KY1GFMG						B07KY1GFMG				AMAZON_NA	Migrated Template	Inactive
Nivea Rich Nourishing Body Cream Dry Skin Almond Oil 400 ml		1012AD9PBEF	EH-6G14-4YDP	10		2023-10-12 09:49:14 PDT		y	1			11				B00JAXKNJ6						B00JAXKNJ6				AMAZON_NA	Migrated Template	Inactive
Partypom Formula 409 Multi Surface Cleaner Spray Bottle Original and Lemon Scented, 3 Pack, 32 Ounces Each Plus Bonus Tissue Packet		0328BWB9V7Q	EH-RVQS-9ESV	26.99		2024-03-28 12:30:40 PDT		y	1			11				B0B4T8B3L6						B0B4T8B3L6				AMAZON_NA	Migrated Template	Inactive
Dechra Miconahex +Triz Pet Wipes 50ct.		0403B9HFBQ8	EI-XBRD-4BLX	20.91		2024-04-02 17:26:03 PDT		y	1			11				B01JYYPU4S						B01JYYPU4S				AMAZON_NA	Migrated Template	Inactive
ConairPRO Dog & Cat Deluxe Pet Washer		1206ABRFBYT	EJ-N32Z-9IMS	23.99		2023-12-06 10:15:07 PST		y	1			11				B005KSOB6G						B005KSOB6G				AMAZON_NA	Migrated Template	Inactive
Moist & Meaty Chopped Burger by Nestle Purina Petcare		0401B5W57DQ	EJ-RLAK-SPP7	22.99		2024-04-01 13:25:54 PDT		y	1			11				B0007A67VE						B0007A67VE				AMAZON_NA	Migrated Template	Inactive
Temptations Hairball Control, Chicken (Pack of 12)		0315BZ477MR	EK-3YHM-QL3W	46.99		2024-03-15 10:30:26 PDT		y	1			11				B07PFW4NKC						B07PFW4NKC				AMAZON_NA	Migrated Template	Inactive
Stram QuikStrike Fly Bait Spray 1lb		0615ACJJA2T	EK-BCBB-PWZH	22.99		2023-06-15 13:23:27 PDT		y	1			11				B09RX3NB7C						B09RX3NB7C				AMAZON_NA	Migrated Template	Inactive
Febi Bilstein for Mercedes 2Lt Hydraulic Fluid for Suspension and Convertible		0412B1FYI4W	EN-N61S-JG0P	38.27		2024-04-12 06:30:23 PDT		y	1			11				B00QB23FGC						B00QB23FGC				AMAZON_NA	Migrated Template	Inactive
Bic Metal Quality Disposable Men's Shaving Razors, Best Single Blade, 10-Count		0105BF37DMU	EP-KOW5-ISZG	1		2024-01-05 14:44:11 PST		y	1			11				B01DJQDB2A						B01DJQDB2A				AMAZON_NA	Migrated Template	Inactive
Summit Mosquito Dunks (2) 6pks. 12 Dunks Total		0829A2I0OXB	EP-NUFI-5M7M	24.99		2023-08-29 06:49:21 PDT		y	1			11				B07LGZBG8K						B07LGZBG8K				AMAZON_NA	Migrated Template	Inactive
Dove Go Fresh Shower Gel Body Wash, Lavender and Chamomile, 33.8 Ounce Pump Bottle		0724AE9OCDG	EQ-8913-5H3D	19.99		2023-07-24 12:44:11 PDT		y	1			11				B0BKB2KN8F						B0BKB2KN8F				AMAZON_NA	Migrated Template	Inactive
Terro Liquid Ant Killer II, 1 oz, Pack of 3		1009A56L52D	ER-MGWR-BNLD	14.69		2023-10-09 13:46:39 PDT		y	1			11				B00MYH0304						B00MYH0304				AMAZON_NA	Migrated Template	Inactive
all Mighty Pacs Laundry Detergent, Free Clear for Sensitive Skin, 2 Tubs, 134 Total Loads,67 Count (Pack of 2)		0307BD7EFRT	ER-Q6C2-D7KL	52.99		2024-03-07 11:37:02 PST		y	1			11				B016BAOKK8						B016BAOKK8				AMAZON_NA	Migrated Template	Inactive
Pantene Pro-V Classic Clean Shampoo, 12.6 Fl Oz (Pack of 2)		0105BFA0A0E	ES-OHBB-G4QO	20.99		2024-01-05 14:44:10 PST		y	1			11				B00JGQ7ZW0						B00JGQ7ZW0				AMAZON_NA	Migrated Template	Inactive
Palmolive 40043 OXY Power Degreaser for Pots and Pans, 1 gallon Bottle		0613A541E68	ET-3I7Q-GWKE	27.99		2023-06-13 08:22:57 PDT		y	1			11				B0002ZWGT6						B0002ZWGT6				AMAZON_NA	Migrated Template	Inactive
Dr. Bronner's Cinnamon Toothpaste 5 oz (Pack of 1)		0326BQV160T	ET-7TZW-8HV2	12.99		2024-03-26 08:54:16 PDT		y	1			11				B0B4L76HC3						B0B4L76HC3				AMAZON_NA	Migrated Template	Inactive
ZuPreem NutBlend Smart Pellets Bird Food for Parrots & Conures, 3.25 lb (Pack of 2) - Made in USA, Daily Nutrition, Vitamins, Minerals for African Greys, Senegals, Amazons, Eclectus, Cockatoos		1003AOYAGDL	EV-Z0XZ-LV4R	39.2		2023-10-03 13:05:36 PDT		y	1			11				B06XYNHBL8						B06XYNHBL8				AMAZON_NA	Migrated Template	Inactive
Redbarn Protein Puffs for Dogs | High-Protein Training Treat or Food Topper | Made in The USA (Cheese, Pack of 3)		0325BO1QVRU	EZ-HNYD-J0XK	19.91		2024-03-25 08:58:13 PDT		y	1			11				B07P22JNGB						B07P22JNGB				AMAZON_NA	Migrated Template	Inactive
AJAX Ultra Professional Triple Action, Pot & Pan Degreaser, Orange, 1 Gallon		0629AG765XD	F0-U3WP-5BDZ	22.85		2023-06-29 09:41:24 PDT		y	1			11				B085122Y11						B085122Y11				AMAZON_NA	Migrated Template	Inactive
Pet Naturals of Vermont L-Lysine 60 Fun-Shaped Chews for Cats - 2 pack		0913A8I8YTR	F1-H9DO-0BP3	18.99		2023-09-13 13:55:38 PDT		y	1			11				B00A1MOTA4						B00A1MOTA4				AMAZON_NA	Migrated Template	Inactive
Virbac Animal Health C.e.t. Enzymatic Chews for Dogs		0404BCTYHNW	F2-BYJW-Q4BC	35.99		2024-04-03 18:33:33 PDT		y	1			11				B07GYSLZ8B						B07GYSLZ8B				AMAZON_NA	Migrated Template	Inactive
Friskies Purina Party Mix Cat Treats Variety Pack, 1 Pouch Picnic Crunch, 1 Pouch Original Crunch, 1 Pouch Wild West Crunch, 2.1 Ounce Pouches (Pack of 3)		0401B5W2WF4	F3-ZQN0-Q728	14.99		2024-04-01 13:15:56 PDT		y	1			11				B00SF3762Y						B00SF3762Y				AMAZON_NA	Migrated Template	Inactive
Nv Toothpaste		0913A8KB9IC	F4-KCG3-AB6X	19.99		2023-09-13 13:52:27 PDT		y	1			11				B07PGZK2FY						B07PGZK2FY				AMAZON_NA	Migrated Template	Inactive
Bravo Homestyle Freeze Dried Dinner Beef Food, 6 Lb.		0305B7BXTO4	F6-U3XG-T38N	89.99		2024-03-05 11:49:27 PST		y	1			11				B00PMD4CBS						B00PMD4CBS				AMAZON_NA	Migrated Template	Inactive
Roma Laundry Detergent - 4.4 lbs.		0714ANRYV7L	F8-FLUX-2CAB	16.99		2023-07-14 13:11:53 PDT		y	1			11				B00L869ZPQ						B00L869ZPQ				AMAZON_NA	Migrated Template	Inactive
RENPURE Plant-Based Beauty Tea Tree & Lemon Sage Refreshing Moisture Shampoo, Basic, Eucalyptus, 16 Fl Oz		0803A47WEWP	FA-4L44-MWGX	15.99		2023-08-03 05:30:41 PDT		y	1			11				B07N4M2GDY						B07N4M2GDY				AMAZON_NA	Migrated Template	Inactive
Brach's Caramel Nips Candies Peg, 3.25 Ounce, Pack of 3		1129AUWMVG5	FA-JEVF-78B8	13.99		2023-11-29 14:03:45 PST		y	1			11				B0C9FJRT2H						B0C9FJRT2H				AMAZON_NA	Migrated Template	Inactive
Dechra EicosaDerm Omega 3 Liquid for Dogs & Cats - Nutritional Fatty Acid Supplement, 8 Fl Oz (Pack of 1)		0403B9NDF34	FA-VRWX-DA3Z	28.48		2024-04-02 17:31:53 PDT		y	1			11				B07YFFH1MP						B07YFFH1MP				AMAZON_NA	Migrated Template	Inactive
Gourmet Box Turtle Food Net Wt 8.25oz (254g)		0401B5V0S7G	FB-AUA9-YK8A	17.39		2024-04-01 10:21:50 PDT		y	1			11				B00VBPIVRW						B00VBPIVRW				AMAZON_NA	Migrated Template	Inactive
OWell TrueMetrix Blood Glucose Testing Kit. Includes: Meter, 10 Test Strips, 10 Lancets, Adjustable Lancing Device, Control Solution, Owners Log Book & Manual		0304B4JPD8B	FB-XAM4-5PGO	19.99		2024-03-04 14:57:31 PST		y	1			11				B01HDYR9HM						B01HDYR9HM				AMAZON_NA	Migrated Template	Inactive
Iron OUT Powder Rust Stain Remover, Remove and Prevent Rust Stains in Bathrooms, Kitchens, Appliances, Laundry, and Outdoors, 9.5 Pound		0829A37BTJF	FC-4HQK-4L44	41.47		2023-08-29 12:41:56 PDT		y	1			11				B000DZBJQ6						B000DZBJQ6				AMAZON_NA	Migrated Template	Inactive
Dove Silky Nourishment Body Cream 300ml - 4 Pack		0907ARZ6KE6	FC-9M8G-TKHO	28.89		2023-09-07 13:20:07 PDT		y	1			11				B01ETGUQ3G						B01ETGUQ3G				AMAZON_NA	Migrated Template	Inactive
Dr. Marty Nature's Blend For Active Vitality Seniors Freeze Dried Raw Dog Food, 16 oz		0306BA45T08	FF-C4IK-GKJK	39.99		2024-03-06 11:15:59 PST		y	1			11				B0B65T7CPL						B0B65T7CPL				AMAZON_NA	Migrated Template	Inactive
Manna Pro 1000216 667831 Hen Healer, 2-Ounces, 2 Ounce (Pack of 1), White		0411A2VT4P2	FH-U4XW-8MPJ	12		2023-04-11 08:15:24 PDT		y	1			11				B01CKFBNDA						B01CKFBNDA				AMAZON_NA	Migrated Template	Inactive
Savory Prime 42008 Duck & Sweet Potato Dog Treats, 8 Oz		0422BSSFMC6	FJ-POIB-QBW1	15.99		2024-04-21 19:15:13 PDT		y	1			11				B019SCINOU						B019SCINOU				AMAZON_NA	Migrated Template	Inactive
Prodigy Glucose Monitor Kit - Includes Prodigy Meter, 100ct test strips, 10ct Lancets, Lancing device, Carrying Case, Log Book		0522AGKSEUY	FK-LZAO-A047	24.99		2023-05-22 14:46:30 PDT		y	1			11				B07S2T64BL						B07S2T64BL				AMAZON_NA	Migrated Template	Inactive
Pet-Ag Nurser Bottle - 4 oz, Pack of 4 - Promotes the Natural Feeding of Liquids - Designed for Larger Animals - Durable & Easy to Clean		0219AWBVSLN	FLHARDWARE-1	16.99		2023-02-19 01:03:38 PST		y	1			11				B075TJLNWG						B075TJLNWG				AMAZON_NA	Migrated Template	Inactive
Pet-Ag Goat’s Milk Esbilac Powder - 12 oz, Pack of 2 - Powdered Puppy Formula with Prebiotics, Probiotics & Vitamins for Puppies Newborn to Six Weeks Old - for Sensitive Digestive Systems		0718ZZMHTB8	FLHARDWARE-2	40.12		2022-07-18 14:12:29 PDT		y	1			11				B01LBA6MCC						B01LBA6MCC				AMAZON_NA	Migrated Template	Inactive
Avon Skin So Soft Original, 25 oz (Pack of 2)		0718ZZQN1VT	FLHARDWARE-3	64.99		2022-07-18 14:12:59 PDT		y	1			11				B008RDEI0A						B008RDEI0A				AMAZON_NA	Migrated Template	Inactive
Black Flag Roach Motel Insect Trap(2 Packs 4 Traps)		0601A88VRMX	FLHARDWARE-4	14.99		2023-06-01 04:10:03 PDT		y	1			11				B00UW0TQ6M						B00UW0TQ6M				AMAZON_NA	Migrated Template	Inactive
ZuPreem FruitBlend Flavor with Natural Flavors for Very Small Birds		0906ZJP28VS	FLORIDAHARDWARE-19	16.5		2022-09-06 09:59:41 PDT		y	1			11				B078RGMFSR						B078RGMFSR				AMAZON_NA	Migrated Template	Inactive
WD-40 Multi-Use Product Spray Applicator [4-Pack]		0723UEVKQHZ	FLORIDAHARDWARE-7	15		2018-07-23 09:39:52 PDT		y	1			11				B001BY91RW						B001BY91RW				AMAZON_NA	Migrated Template	Inactive
Brut Classic Scent Cologne 5 Ounce (145ml) (3 Pack)		0111BUFCYW0	FM-8D98-YOV0	27.99		2024-01-11 14:56:52 PST		y	1			11				B01BDX0ZTS						B01BDX0ZTS				AMAZON_NA	Migrated Template	Inactive
AniMed L-Lysine for Horses, 16-Ounce		1127AP5P8NJ	FM-A8Z1-4MEK	16.99		2023-11-27 11:32:42 PST		y	1			11				B00LFNI30K						B00LFNI30K				AMAZON_NA	Migrated Template	Inactive
Dove Nourishing Body Care Rich Nourishment Cream with 48 Hour Moisturization - (2.58 FL OZ)		0107BIGYBC8	FM-K1AI-B10O	10		2024-01-07 02:59:52 PST		y	1			11				B00HOXJ1VU						B00HOXJ1VU				AMAZON_NA	Migrated Template	Inactive
BADLANDS RANCH by Katherine Heigl- Superfood Complete, Air-Dried Adult Dog Food - High Protein, Zero Fillers, Superfood Nutrition (11.5 oz., Lamb & Venison)		0306BA67H8P	FM-MJEF-UEC7	29.99		2024-03-06 11:17:44 PST		y	1			11				B0CW2666TG						B0CW2666TG				AMAZON_NA	Migrated Template	Inactive
Purina Fancy Feast Creamy Delights Wet Cat Food, Chicken Feast with Real Milk in Creamy Sauce, Easily Digestible Wet Cat Food for Adult Cats, 3 OZ Can (Pack of 12)		0401B6063AI	FN-U6MH-5K6B	24.99		2024-04-01 13:15:13 PDT		y	1			11				B0C4M1K4WL						B0C4M1K4WL				AMAZON_NA	Migrated Template	Inactive
Taste Of The Wild High Prairie Can Dog Food,13.2 Oz case of 12		0408BPME0TB	FO-520D-AKP7	48.99		2024-04-08 14:29:17 PDT		y	1			11				B00CAOBBNE						B00CAOBBNE				AMAZON_NA	Migrated Template	Inactive
Enviro Pro 1006 Deer Scram Repellent Granular White Pail, 5.75 Pounds, (Packaging May Vary)		0418BJKOI2T	FO-NQIB-6DJA	49.99		2024-04-18 09:53:48 PDT		y	1			11				B00169FKLI						B00169FKLI				AMAZON_NA	Migrated Template	Inactive
TropiClean Fresh Breath for Dogs | No Brush Dental Gel for Dogs | Dog Dental Gel & Toothpaste for Plaque, Tartar & Stinky Breath | Made in the USA | 4 oz.		0420AVNO66Y	FP-2YW6-GTS5	19.99		2023-04-20 06:10:24 PDT		y	1			11				B00379KT66						B00379KT66				AMAZON_NA	Migrated Template	Inactive
Summit Responsible Solutions Mosquito Bits - Quick Kill, 60-Ounce (2 Pack)		0829A2M4FFB	FP-FF20-HYY8	34.99		2023-08-29 06:48:03 PDT		y	1			11				B00O2KYORO						B00O2KYORO				AMAZON_NA	Migrated Template	Inactive
Greenies Pill Pockets, 30 Count, Chicken Flavor, 3 Pack		0602ABP5VBW	FR-LB0X-DAWM	28.99		2023-06-02 05:08:18 PDT		y	1			11				B01A5TJL2S						B01A5TJL2S				AMAZON_NA	Migrated Template	Inactive
Ambi Skincare Bars Complexion Cleansing Bar, 3.5 Ounce (Pack of 6)		1018AS7ZUHK	FS-JNQD-71RM	23.99		2023-10-18 08:46:53 PDT		y	1			11				B0056GIKI2						B0056GIKI2				AMAZON_NA	Migrated Template	Inactive
Mitchum Advanced Gel Anti-Perspirant & Deodorant, Mountain Air, 3.4 Ounce (Pack of 4)		1129AUWSTJ0	FT-MJDX-3PO6	22.12		2023-11-29 13:59:00 PST		y	1			11				B001EWEP04						B001EWEP04				AMAZON_NA	Migrated Template	Inactive
(2 Pack) Zoo Med Reptisun 10.0 Uvb Mini Compact Fluorescent		0306BA2CYDC	FU-97WA-TC89	29.99		2024-03-06 09:20:33 PST		y	1			11				B07WQXYB9L						B07WQXYB9L				AMAZON_NA	Migrated Template	Inactive
