item-name	item-description	listing-id	seller-sku	price	quantity	open-date	image-url	item-is-marketplace	product-id-type	zshop-shipping-fee	item-note	item-condition	zshop-category1	zshop-browse-path	zshop-storefront-feature	asin1	asin2	asin3	will-ship-internationally	expedited-shipping	zshop-boldface	product-id	bid-for-featured-placement	add-delete	pending-quantity	fulfillment-channel	merchant-shipping-group	status
Clorox Clean-Up Cleaner Spray with Bleach, 32 fl. oz. (Pack of 2)		1010A86Q376	0R-HDY9-CZ8A	19.99		2023-10-10 13:50:08 PDT		y	1			11				B075RWBGN2						B075RWBGN2				AMAZON_NA	Migrated Template	Inactive
Bactine MAX First Aid Spray - Pain Relief Cleansing Spray with 4% Lidocaine - Numbing Lidocaine Spray Kills 99% of Germs - Pain + Itch Relief for Minor Cuts & Scrapes, Burns & Bug Bites - 5oz, 4 Pack		0915AED1LUG	0R-QFNC-FTN7	28.99		2023-09-15 12:56:03 PDT		y	1			11				B07V5R8F1H						B07V5R8F1H				AMAZON_NA	Migrated Template	Inactive
Vital Cat Freeze-Dried All-Natural Chicken Hearts Cat Treats, 0.8 oz.		1025ABDDNNT	0T-JDXM-DQMM	10.11		2023-10-25 12:18:05 PDT		y	1			11				B06XN61PYR						B06XN61PYR				AMAZON_NA	Migrated Template	Inactive
Stella & Chewy's, Grass-Fed Lamb Recipe Raw Coated Kibble Dry Dog Food, 3.5 Pound		0403BBMHW1W	0U-HLFJ-6T1R	30.99		2024-04-03 08:34:37 PDT		y	1			11				B07B5XPDHS						B07B5XPDHS				AMAZON_NA	Migrated Template	Inactive
Mane 'n Tail Detangler 12 oz (Pack of 2)		0108BKNLM1I	10-ACMD-GSVW	15		2024-01-08 05:26:40 PST		y	1			11				B00HR98WLQ						B00HR98WLQ				AMAZON_NA	Migrated Template	Inactive
Temptations Classic Cat Treats Seafood Medley Flavor, 16 Oz. Tub		0511AKD7NRU	10-BFU0-G6JT	7		2023-05-11 09:17:47 PDT		y	1			11				B00IOOOWBM						B00IOOOWBM				AMAZON_NA	Migrated Template	Inactive
Alteril All Natural Sleep Aid 30 Tablets (Pack of 2)		1011AAJX2JW	10-N1IN-F07P	32.73		2023-10-11 11:17:34 PDT		y	1			11				B00KHX9NY4						B00KHX9NY4				AMAZON_NA	Migrated Template	Inactive
Lady Speed Stick Deodorant 2.3oz Powder Fresh Power (2 Pack)		0908AUMNT7Q	11-0BB1-JYAH	8.9		2023-09-08 09:25:27 PDT		y	1			11				B01CKGNVKM						B01CKGNVKM				AMAZON_NA	Migrated Template	Inactive
AniMed ULC-R-Aid 4 lb		1127AP51YWZ	12-XX2G-5WRQ	36.99		2023-11-27 11:31:28 PST		y	1			11				B000QFRKRA						B000QFRKRA				AMAZON_NA	Migrated Template	Inactive
Nupro Health Nuggets for Cats (1lb jar)		1110AIXVAG5	14-NZNW-5SL9	27.99		2023-11-10 08:48:43 PST		y	1			11				B00074W13I						B00074W13I				AMAZON_NA	Migrated Template	Inactive
Mop & Glo Multi-Surface Floor Cleaner, 32 Ounce (Pack of 4)		0927A9YP2GZ	16-L8IX-NQ39	39.99		2023-09-27 12:46:14 PDT		y	1			11				B071FJYTSX						B071FJYTSX				AMAZON_NA	Migrated Template	Inactive
Suave Essentials Revitalizing Shampoo, Juicy Green Apple, 15 fl oz (2 pack) (Bundle)		0109BOUQHB8	16-YZMZ-HFKB	14.95		2024-01-09 13:43:05 PST		y	1			11				B088P7K3GN						B088P7K3GN				AMAZON_NA	Migrated Template	Inactive
Higgins Sunburst Parakeet Bird Food Gourmet Blend Parakeet Bird Food Mix 2 lb. bag. Fast Just Jak's Pet Market		0828AZU4ZTP	17-X09C-53EX	13.62		2023-08-28 14:46:55 PDT		y	1			11				B07G9S5GQ2						B07G9S5GQ2				AMAZON_NA	Migrated Template	Inactive
BRUT Deodorant Stick Original Fragrance 2.50 oz (Pack of 8)		0201AHTSCCB	1830489	27.99		2023-02-01 08:48:25 PST		y	1			11				B01IA9DA1S						B01IA9DA1S				AMAZON_NA	Migrated Template	Inactive
Purina Friskies Party Mix Cat Treats, Beachside Crunch, Made with Ocean Whitefish, Crunchy Cat Treats for Adult Cats, 20-Ounce Resealable Canister (Pack of 2)		0401B60KXXI	1D-0A71-Y76M	28.99		2024-04-01 13:18:39 PDT		y	1			11				B0BJMG5CSW						B0BJMG5CSW				AMAZON_NA	Migrated Template	Inactive
Grain Free Crunch 1 Bacon Blueberry & 1 Turkey, Sweet Potato & Cranberry 2 pack		0428AK91V5W	1F-FNF0-21N1	15.99		2023-04-28 13:42:07 PDT		y	1			11				B01MQ3W4I9						B01MQ3W4I9				AMAZON_NA	Migrated Template	Inactive
BAND-AID Bandages Travel Kit 8 Each (Pack of 2)		0613A58PYZK	1G-N5YX-1JTI	10		2023-06-13 08:22:42 PDT		y	1			11				B0BN2BV7QX						B0BN2BV7QX				AMAZON_NA	Migrated Template	Inactive
Three Bond High Performance/Adhesion Liquid Gasket TB1207B		0315BYW3H4F	1J-LBER-0J73	26.05		2024-03-15 08:42:28 PDT		y	1			11				B008BYPRRI						B008BYPRRI				AMAZON_NA	Migrated Template	Inactive
GE Advanced Silicone Kitchen & Bath Sealant White, 10.1 oz, 1, Cartridge		0411A2PWOC3	1N-0U38-NG9U	16.99		2023-04-11 08:12:08 PDT		y	1			11				B0000DI82L						B0000DI82L				AMAZON_NA	Migrated Template	Inactive
Charlee Bear Crunch Bacon & Blueberry Flavor Dog Treat and Snack (2 Pack) 8 oz Each		0428AKA97JO	1N-NJ5R-L00U	15.73		2023-04-28 13:42:58 PDT		y	1			11				B077ZL5FWG						B077ZL5FWG				AMAZON_NA	Migrated Template	Inactive
32oz Tree & Shrub Drench		0412B1M3NNA	1O-AL5M-5VGV	24.99		2024-04-12 09:57:57 PDT		y	1			11				B005XOPAPI						B005XOPAPI				AMAZON_NA	Migrated Template	Inactive
Springer Magrath® Orphan-No-More Calf Claimer Powder | Powdered Calf & Lamb Claim Aids in Newborn Adoption | 9 oz		0404BCZ8F1M	1Q-OSQO-0XTI	25.89		2024-04-03 19:35:38 PDT		y	1			11				B005IPKQL0						B005IPKQL0				AMAZON_NA	Migrated Template	Inactive
Greenies Pill Pockets Soft Dog Treats, Peanut Butter, Tablet, 3.2 Oz. (Pack Of 6)		0124BPLXHWP	1Q-X3V6-MC64	36.99		2024-01-24 09:45:49 PST		y	1			11				B00CHMSHMW						B00CHMSHMW				AMAZON_NA	Migrated Template	Inactive
Penn-Plax Replacement Impeller for Cascade 1000 Canister Filters		0829A3HG0FY	1S-M0NO-R3PS	23.99		2023-08-29 13:00:58 PDT		y	1			11				B0002DJD3U						B0002DJD3U				AMAZON_NA	Migrated Template	Inactive
Red Line 60103 SI-1 Complete Fuel System Cleaner - 15 Ounce (2 Pack)		0405BFXVMQX	1U-ODBF-WLLK	33.28		2024-04-05 00:04:51 PDT		y	1			11				B00NQB7OM2						B00NQB7OM2				AMAZON_NA	Migrated Template	Inactive
Greenies Aging Care Large Natural Dental Care Dog Treats, 27 oz. Pack (17 Treats)		0712AGBWOQY	1V-FLJP-CA1B	60		2023-07-12 08:30:08 PDT		y	1			11				B07JZJTNL1						B07JZJTNL1				AMAZON_NA	Migrated Template	Inactive
Purina Pro Plan High Protein Wet Cat Food in Gravy, Beef and Cheese Entree - (24) 3 oz. Pull-Top Cans		0305B7BOQO8	1V-ZH3I-MM3Y	44.99		2024-03-05 12:19:05 PST		y	1			11				B008K2UFQO						B008K2UFQO				AMAZON_NA	Migrated Template	Inactive
Ricola Honey Herb Herbal Cough Suppressant Throat Drops, 24ct Bag (Pack of 5)		0415B940E2A	1X-39X0-JWVH	20.99		2024-04-15 09:49:33 PDT		y	1			11				B0029EWB34						B0029EWB34				AMAZON_NA	Migrated Template	Inactive
GoodEarth Diatomaceous Earth Supplement for Chicken and Farm Animals,NET WT 2 LBS		1204A63HTPQ	1Y-BYQR-KG5R	19.99		2023-12-04 10:47:20 PST		y	1			11				B00AQ4CTPE						B00AQ4CTPE				AMAZON_NA	Migrated Template	Inactive
Fruitables Skinny Minis Gluten Free Chewy Dog Treats Pumpkin & Berry Flavor (3 Pack) 5 oz Each		0206BJQ76KZ	1Y-GSVE-5V5Z	17.99		2024-02-06 11:48:43 PST		y	1			11				B07CRDXBVZ						B07CRDXBVZ				AMAZON_NA	Migrated Template	Inactive
Huy Fong Sriracha Chili Hot Sauce, 28 oz Bottle (Pack of 2) (1 Pack)		0411A2SE3FB	1Y-YC17-TXLX	28.99		2023-04-11 07:57:28 PDT		y	1			11				B00U9VTL5U						B00U9VTL5U				AMAZON_NA	Migrated Template	Inactive
Milton Closed Ball Air Chuck with Safety Clip-on Grip, 1/4" FNPT, Tire Pressure Gauge, Air Hose Quick Connect Adapter, S-698, SILVER		0423BY0BTIY	1Z-J1ZU-LGJQ	13.49		2024-04-23 06:07:31 PDT		y	1			11				B0002SQT9Q						B0002SQT9Q				AMAZON_NA	Migrated Template	Inactive
Van Der Hagen Shave Butter- Best Shave 3 pack (6 oz/tube)		1018AS7XD9I	1Z-VKMC-IH1H	20.99		2023-10-18 09:33:32 PDT		y	1			11				B07D6TNCRC						B07D6TNCRC				AMAZON_NA	Migrated Template	Inactive
Hikari Betta BioGold Baby Pellet 0.7oz [2-Pack]		1101AU5JHF2	28-VDXP-LPKP	15.44		2023-11-01 11:26:01 PDT		y	1			11				B013EXTU7S						B013EXTU7S				AMAZON_NA	Migrated Template	Inactive
Pfizer Animal Pet-Tinic Vitamin-Mineral Supplement for Dogs and Cats, 4-Ounce by Pfizer Animal		0403B9IN3CT	2A-HJ1X-QMLN	25.85		2024-04-02 17:24:54 PDT		y	1			11				B01IO9191W						B01IO9191W				AMAZON_NA	Migrated Template	Inactive
Friskies Party Mix Crunch Variety Pack (9 Flavors) - Wild West, Morning Munch, Mixed Grill, Picnic, Beachside, Cheezy Craze, Original, California Dreamin', and Meow Luau		0401B5ZOIUE	2A-IENV-6PVD	32.99		2024-04-01 13:16:06 PDT		y	1			11				B00QT2PA9Y						B00QT2PA9Y				AMAZON_NA	Migrated Template	Inactive
Motul 8100 X-clean EFE 5W-30 Synthetic Oil 5 Liters (109471), 5 l, 1 Pack		0404BCSH16Q	2B-YPLF-45WS	64		2024-04-03 18:04:45 PDT		y	1			11				B01MT1X517						B01MT1X517				AMAZON_NA	Migrated Template	Inactive
Charlee Bear Dog Treat with Cheese & Egg (2 Pack) 6 oz Each		0315BYWPHEO	2C-C9DF-KUCT	14.98		2024-03-15 07:32:52 PDT		y	1			11				B077ZJC251						B077ZJC251				AMAZON_NA	Migrated Template	Inactive
Sogeval Douxo Micellar Ear Cleansing Solution for Pets, 8.4-Ounce		0403B9L455N	2C-ZE8H-RW1O	27.8		2024-04-02 17:37:37 PDT		y	1			11				B07B16DDMG						B07B16DDMG				AMAZON_NA	Migrated Template	Inactive
ORIJEN 3 Pack of Original Cat Treats, 1.25 Ounces Each, Freeze-Dried, Grain-Free, Made in The USA		1018ASAF0HW	2D-4A9S-9ZLO	20.99		2023-10-18 10:41:19 PDT		y	1			11				B07ZZL5ZQV						B07ZZL5ZQV				AMAZON_NA	Migrated Template	Inactive
NUTRO Crunchy Dog Treats with Real Apple, 16 oz. Bag		0315BZEMNZI	2D-VJ97-H1LK	20.99		2024-03-15 10:27:30 PDT		y	1			11				B008T6S7XE						B008T6S7XE				AMAZON_NA	Migrated Template	Inactive
DechraSupply Phycox MAX Small Bites, Joint Supplement for Dogs (120ct)		0403B9KRUZJ	2E-Y3KX-GZDO	60.45		2024-04-02 17:27:52 PDT		y	1			11				B07YFH99SX						B07YFH99SX				AMAZON_NA	Migrated Template	Inactive
Cepacol Maximum Strength Throat Drop Lozenges, Cherry, 16 Count (Pack of 2)		0522AGRKMMZ	2F-FJ7R-MRE7	16.99		2023-05-22 14:49:23 PDT		y	1			11				B01FWS2U0W						B01FWS2U0W				AMAZON_NA	Migrated Template	Inactive
Chuckit! Dog Ball Launcher, Sport 14S - 2PK		1113AP3Q7LK	2G-BSJF-GHTB	17		2023-11-13 05:42:50 PST		y	1			11				B07JN8LMJ1						B07JN8LMJ1				AMAZON_NA	Migrated Template	Inactive
SYLVANIA 9007 LED Powersport Headlight Bulbs for Off-Road Use or Fog Lights - 2 Pack		0417BEZFLOI	2H-5BVG-ETRP	96.75		2024-04-17 02:17:20 PDT		y	1			11				B09DQZ2RG9						B09DQZ2RG9				AMAZON_NA	Migrated Template	Inactive
ZuPreem Pure Fun Bird Food for Large Birds, 2 lb - Variety Blend of Fruit, FruitBlend Pellets, Vegetables, Nuts for Amazons, Macaws, Cockatoos		1003AOPO7NY	2I-2ZP4-B1F4	21.99		2023-10-03 12:57:56 PDT		y	1			11				B01GVVJM6E						B01GVVJM6E				AMAZON_NA	Migrated Template	Inactive
Dr. Bronner’s - All-One Toothpaste (Peppermint, 5 Ounce, 3-Pack) - 70% Organic Ingredients, Natural and Effective, Fluoride-Free, SLS-Free, Helps Freshen Breath, Reduce Plaque, Whiten Teeth, Vegan		0326BQRXI3B	2J-A9R2-L8HS	22.99		2024-03-26 08:54:25 PDT		y	1			11				B015CVWCN4						B015CVWCN4				AMAZON_NA	Migrated Template	Inactive
Toyota Oil Filter - 90915YZZF2		0412B1H3391	2J-LOBZ-OL3A	32		2024-04-12 06:31:07 PDT		y	1			11				B00A1XLSQG						B00A1XLSQG				AMAZON_NA	Migrated Template	Inactive
Eco Style Styling Gel Super Protein, Black, 16 Ounce		0415B9788ST	2K-850K-LKFO	12.99		2024-04-15 09:49:09 PDT		y	1			11				B005I4QWQO						B005I4QWQO				AMAZON_NA	Migrated Template	Inactive
Checkups- Dental Dog Treats, 1Pack (48oz (24 Count Each )) Ak%Hles		0222BDYPKU8	2K-AN6R-H9NC	28.99		2024-02-22 10:36:23 PST		y	1			11				B076MJFQV1						B076MJFQV1				AMAZON_NA	Migrated Template	Inactive
Dove, Body Wash, Lotus Flower Extract & Rice Water - 16.9 Fl		0306B9W5TKU	2L-3C60-LU6X	19.99		2024-03-06 08:41:57 PST		y	1			11				B07MG8WCVC						B07MG8WCVC				AMAZON_NA	Migrated Template	Inactive
API Bottom Feeder Shrimp Pellet 7.9 Ounce (2 Pack)		0404BCSUFI3	2L-SXTC-D9S1	20.79		2024-04-03 18:23:41 PDT		y	1			11				B00DDZ9UIC						B00DDZ9UIC				AMAZON_NA	Migrated Template	Inactive
Flex 2500 Soft Chews - 240 ct - Joint Health for Dogs		1220ADQ2M6W	2M-FSOZ-XYVQ	68		2023-12-20 05:44:49 PST		y	1			11				B003J9FMV6						B003J9FMV6				AMAZON_NA	Migrated Template	Inactive
200g POND'S CLARANT B3 Lightening Face Cream W/UV Protection Normal To Oily Skin		0913A7VUILI	2M-JM71-2QYZ	14.99		2023-09-13 07:18:46 PDT		y	1			11				B00GNBH6NO						B00GNBH6NO				AMAZON_NA	Migrated Template	Inactive
Friskies Purina Chicken & Waffle Flavors (1-6 OZ Bag)		0401B635S7B	2N-FH6G-NMVB	10.99		2024-04-01 13:23:29 PDT		y	1			11				B07GTT6TS7						B07GTT6TS7				AMAZON_NA	Migrated Template	Inactive
ZuPreem Natural Bird Food Pellets for Parrots & Conures, 3 lb (Pack of 2) - Daily Nutrition, Made in USA for Caiques, African Greys, Senegals, Amazons, Eclectus		1003AOWD8Q3	2N-FR5B-F00H	31.36		2023-10-03 13:08:15 PDT		y	1			11				B0818PRRT4						B0818PRRT4				AMAZON_NA	Migrated Template	Inactive
Fluval 9 Pack of Ammonia Remover for 106/206 and 107/207 Aquarium Filters		1109AFPCS4N	2P-FWH3-BCPL	19.82		2023-11-09 11:51:38 PST		y	1			11				B07YXCKBXQ						B07YXCKBXQ				AMAZON_NA	Migrated Template	Inactive
TropiClean Fresh Breath Puppy Oral Care Kit | Puppy Toothbrush and Toothpaste Kit for Plaque & Tartar Control | Dog Tooth Brushing Kit for Puppies		0522AGXYYVC	2Q-6K54-GWXZ	16.99		2023-05-22 14:52:10 PDT		y	1			11				B00UL885DU						B00UL885DU				AMAZON_NA	Migrated Template	Inactive
FL!PPER Flipper Cleaner Float - 2-in-1 Floating Magnetic Aquarium Glass Cleaner - Fish Tank Cleaner - Scrubber & Scraper Aquarium Cleaning Tools – Floating Fish Tank Cleaner, Standard		0105BF91Q2H	2S-XBZ0-G5XA	49.99		2024-01-05 14:44:15 PST		y	1			11				B08FBG7JNZ						B08FBG7JNZ				AMAZON_NA	Migrated Template	Inactive
Open Farm Calming Chews, Dog Supplement, Dog Vitamins, Promote Calmness and Reduce Anxiousness Using Traceable and Vet-Approved Ingredients, 12.7 oz, 90 Count		0116B5SW1YL	2U-RFTI-UQOD	34.99		2024-01-16 08:37:07 PST		y	1			11				B09YWRQ5JC						B09YWRQ5JC				AMAZON_NA	Migrated Template	Inactive
Desert Essence Thoroughly Clean Face Wash Original Deep Cleansing Formula with Tea Tree, Castile Soap & Coconut Oil - 32oz - Soothing, Unisex Skin Cleaning Agent		0922AXR3493	2Z-P24X-K5UB	24.99		2023-09-22 14:46:53 PDT		y	1			11				B0057MHTAA						B0057MHTAA				AMAZON_NA	Migrated Template	Inactive
Febreze Pet Odor Eliminator, 27 Oz (Pack of 2)		0417AMG4NKI	31-FT7E-T5K7	26.99		2023-04-17 13:31:08 PDT		y	1			11				B00K5STXPA						B00K5STXPA				AMAZON_NA	Migrated Template	Inactive
Suave New 381380 Shampoo Tropical Coconut 15 Oz (6-Pack) Shampoo Cheap Wholesale Discount Bulk Health & Beauty Shampoo Cup6		0530A3H6P9S	32-0UL1-VMHX	22.99		2023-05-30 12:11:25 PDT		y	1			11				B07SXS3JXP						B07SXS3JXP				AMAZON_NA	Migrated Template	Inactive
Nutrisource Adult Chicken & Rice Dog Food 5Lb		1231A2T8MQC	33-ADUU-DPFS	29.99		2023-12-31 07:01:31 PST		y	1			11				B07D5G3F7B						B07D5G3F7B				AMAZON_NA	Migrated Template	Inactive
Clorox Clean-Up Cleaner Spray with Bleach 32 fl.oz. (946 ml) Pack (2)		0905ALKQWUA	36-MTTN-PSNJ	22.99		2023-09-05 10:55:40 PDT		y	1			11				B075FWWDDT						B075FWWDDT				AMAZON_NA	Migrated Template	Inactive
Dove Body Wash Go Fresh Sakura Blossom with Pink Salt,33.8 Ounce Pump,1 item		0629AG4ZHRH	36-Y2XW-5YLS	18.99		2023-06-29 09:41:47 PDT		y	1			11				B0BH6DJKMM						B0BH6DJKMM				AMAZON_NA	Migrated Template	Inactive
Tea Tree Therapy Vegetable Base Soap with Tea Tree Oil - 3.9 oz - Pack of 9		1005AUY63AN	38-2KI1-HGAS	35.99		2023-10-05 14:17:24 PDT		y	1			11				B006B005Q2						B006B005Q2				AMAZON_NA	Migrated Template	Inactive
ZuPreem FruitBlend Flavor with Natural Flavors - Daily Bird Food For Medium Birds - 2 lb		0209BPICJIX	39-BC1K-IOTZ	11.18		2024-02-09 07:03:16 PST		y	1			11				B0054RV486						B0054RV486				AMAZON_NA	Migrated Template	Inactive
Red Sea Reef Foundation C, Magnesium Supplement, 1 Liter		0918AKMMLUE	39-DOJB-8JLE	32.99		2023-09-18 07:39:43 PDT		y	1			11				B0798TPJ2Z						B0798TPJ2Z				AMAZON_NA	Migrated Template	Inactive
Earthborn Holistic Wet Cat Food Variety Pack - 4 Flavors (Catalina Catch, Harbor Harvest, Chicken Catcciatori, and Monterey Medley) - 5.5 Ounces Each (12 Total Cans)		0227BOOA14H	3B-VXBR-7RZE	32.86		2024-02-27 10:39:45 PST		y	1			11				B010N0314I						B010N0314I				AMAZON_NA	Migrated Template	Inactive
Cetaphil Gentle Cleanser for All Skin Types, (pack of 2, 16oz)		1011AALIML8	3D-VT5H-OD01	35.16		2023-10-11 11:12:41 PDT		y	1			11				B0731D4FT3						B0731D4FT3				AMAZON_NA	Migrated Template	Inactive
AquaIllumination AI Nero 3 Submersible Wavemaker Pump w/Fish Guard - 2000 GPH		0929AF1QK3D	3I-70JI-T6A0	209.99		2023-09-29 10:40:47 PDT		y	1			11				B08KZT7SMQ						B08KZT7SMQ				AMAZON_NA	Migrated Template	Inactive
Colgate Total Toothpaste, Clean Mint, Paste Formula, 4.8 oz (Pack of 3)		0418AP8XTOB	3J-209N-01XW	17.99		2023-04-18 08:02:17 PDT		y	1			11				B07P7Y7RXD						B07P7Y7RXD				AMAZON_NA	Migrated Template	Inactive
NutriSource Cat & Kitten Food, Made with Chicken and Rice, with Wholesome Grains, 6.6LB, Dry Cat Food		1231A2TD7PF	3L-BETE-LYZB	35.99		2023-12-31 07:04:55 PST		y	1			11				B003053AEU						B003053AEU				AMAZON_NA	Migrated Template	Inactive
ACANA 3 Pack of Lamb & Apple Singles Dog Treats, 1.25 Ounces Each, Grain-Free, Limited Ingredient, Made in The USA		0913A7XVMH2	3L-G0AT-XGLB	22.47		2023-09-13 09:29:45 PDT		y	1			11				B07ZZM1RKT						B07ZZM1RKT				AMAZON_NA	Migrated Template	Inactive
Facial Cleansing Pads - Tea Tree Oil, 50 pads 2-pack		0922AXVMSKX	3L-N5Q3-R6WK	18.99		2023-09-22 14:46:46 PDT		y	1			11				B004ORQ2CK						B004ORQ2CK				AMAZON_NA	Migrated Template	Inactive
Irish Spring Deodorant Soap Scent, 20 Count, Original 75 Ounce		0107BIHX7I2	3N-2PMA-7CBK	28		2024-01-07 02:59:51 PST		y	1			11				B075RGWG1D						B075RGWG1D				AMAZON_NA	Migrated Template	Inactive
Suave Naturals Body Wash 15 Ounce Milk & Honey Splash (354ml) (3 Pack)		1025AAU8L8P	3N-8LNL-OHIN	15.99		2023-10-25 07:07:20 PDT		y	1			11				B00GMOU8G4						B00GMOU8G4				AMAZON_NA	Migrated Template	Inactive
SheaMoisture Raw Shea Butter Restorative Conditioner, 13 Ounces - 2pc		0913A8OTDCD	3N-KDE8-SY9B	28.99		2023-09-13 14:31:07 PDT		y	1			11				B01KCJAHHY						B01KCJAHHY				AMAZON_NA	Migrated Template	Inactive
Olay, Cleansing & Firming Body Wash with Vitamin B3 & Collagen, 17.9 Fl Oz		0613A53I89Z	3Q-J7B7-GWVU	17.99		2023-06-13 08:21:39 PDT		y	1			11				B08LMKMRGT						B08LMKMRGT				AMAZON_NA	Migrated Template	Inactive
(2 Pack) API Stress Coat Fish and Tap Water Conditioner, 16-Ounce (Treats 946 Gallons) each		0404BCTZPOW	3S-XEXJ-NQEG	29.22		2024-04-03 18:19:56 PDT		y	1			11				B01N0KVD25						B01N0KVD25				AMAZON_NA	Migrated Template	Inactive
Orijen Tundra Freeze-dried Dog Treats, 3.25-oz Bag (Pack of 3)		0112BWU3RAF	3T-0L56-3DPK	39.99		2024-01-12 07:26:00 PST		y	1			11				B00R08RL3O						B00R08RL3O				AMAZON_NA	Migrated Template	Inactive
Folgers Instant Coffee Crystals, Classic Roast, 24 ounce		0306B9T6TKK	3T-Y1X1-05XA	29.99		2024-03-06 08:28:52 PST		y	1			11				B07VX6H4K8						B07VX6H4K8				AMAZON_NA	Migrated Template	Inactive
Purina Fancy Feast With Ocean Fish & Salmon And Accents Of Garden Greens Gourmet Cat Food		0401B613XLX	3V-GRPG-33ME	10.99		2024-04-01 13:12:18 PDT		y	1			11				B00FNP4JE0						B00FNP4JE0				AMAZON_NA	Migrated Template	Inactive
Stella & Chewy'S Raw Coated Chicken 3.5Lb Dry Dog Food		0403BBHQYNI	3W-JIX0-ED01	32.99		2024-04-03 08:33:36 PDT		y	1			11				B0714J9TFD						B0714J9TFD				AMAZON_NA	Migrated Template	Inactive
BOSCH 3397009843 AeroTwin OE Replacement Wiper Blades Driver & Passenger Side - Set of 2 (22" & 22")		0422BSO4425	3W-NSYJ-KUVM	45.97		2024-04-21 19:43:45 PDT		y	1			11				B06XCZPNZB						B06XCZPNZB				AMAZON_NA	Migrated Template	Inactive
Zoomed Reptitherm Undertank Heater 10-20Gal 6X8		0401B5OJQY5	3W-X6NR-WTDE	22		2024-04-01 10:15:41 PDT		y	1			11				B00BUFWCNC						B00BUFWCNC				AMAZON_NA	Migrated Template	Inactive
Ajax Powder Cleanser with Bleach, 14 oz-3 pk		0531A5L162S	41-YHS6-0SAB	13.99		2023-05-31 07:17:05 PDT		y	1			11				B00J5HK3MY						B00J5HK3MY				AMAZON_NA	Migrated Template	Inactive
Sierra Mountain Dog Food		0408BPQ4BCY	43-AF42-OBY6	29.99		2024-04-08 14:28:36 PDT		y	1			11				B004SBMRK8						B004SBMRK8				AMAZON_NA	Migrated Template	Inactive
Sectpod VetOne OB Lube Sterile		0402B9AWNZR	43-UVB3-HI70	11.95		2024-04-02 14:06:16 PDT		y	1			11				B01NAVFJ1G						B01NAVFJ1G				AMAZON_NA	Migrated Template	Inactive
Dechra Eicosa3FF SnipCaps (Small), for Dogs Up to 60lbs, 120 Count		0221BB6LFVQ	49-941Y-SFUM	42.99		2024-02-21 08:04:28 PST		y	1			11				B07YQH476F						B07YQH476F				AMAZON_NA	Migrated Template	Inactive
Friskies Party Mix Crunch Gravy-Licious Turkey & Gravy Treats (Pack of 2)		0401B61EC6D	4A-IGZI-RWT5	12.99		2024-04-01 13:20:28 PDT		y	1			11				B0845RJ7ST						B0845RJ7ST				AMAZON_NA	Migrated Template	Inactive
Ricola Honey Herb Throat Drop Pack of 3		1024A837N9J	4B-V2VA-AK74	15.99		2023-10-24 09:36:15 PDT		y	1			11				B00IG07888						B00IG07888				AMAZON_NA	Migrated Template	Inactive
Pet Naturals of Vermont L-Lysine 60 Fun-Shaped Chews for Cats - 3 pack		1113AP4A4IR	4D-;AJBN-EYVC	22.5		2023-11-13 05:39:40 PST		y	1			11				B00A1MWAKK						B00A1MWAKK				AMAZON_NA	Migrated Template	Inactive
BOEHRINGER INGELHEIM 2151001 Today - Tube 12 Syringe/Box		1101AU54DFS	4G-D2W0-MALP	99.99		2023-11-01 10:40:07 PDT		y	1			11				B078YG9ZFJ						B078YG9ZFJ				AMAZON_NA	Migrated Template	Inactive
2-Pack Summit Mosquito Dunks		0829A2NZLOJ	4I-1CO7-YVEW	23.99		2023-08-29 06:49:14 PDT		y	1			11				B01LYCI7E3						B01LYCI7E3				AMAZON_NA	Migrated Template	Inactive
2LB Synerg Python Dust		0105BF7RBAG	4M-AEJE-DFHB	8		2024-01-05 14:44:10 PST		y	1			11				B0773MVNN3						B0773MVNN3				AMAZON_NA	Migrated Template	Inactive
Garden Tech Dust Bug Killer Multiple Insects Rtu Carbaryl 1 Lb. (Pack of 2)		0105BF92L36	4N-GAPH-VAKZ	23.99		2024-01-05 14:44:10 PST		y	1			11				B07DDGR56K						B07DDGR56K				AMAZON_NA	Migrated Template	Inactive
Fruitables Baked Dog Treats Pumpkin & Banana Flavor (2 Pack) 7 oz Each		0905ALRL41U	4R-F0CV-Y9U7	7		2023-09-05 13:23:07 PDT		y	1			11				B07CRHCQZ2						B07CRHCQZ2				AMAZON_NA	Migrated Template	Inactive
Weruva Grain Free Cats in The Kitchen Canned Cat Food 10 Flavor Variety Bundle, 3.2 Ounces Each (10 CANS Total)		0915AE1YPJZ	4S-297N-DPSY	22.09		2023-09-15 11:43:04 PDT		y	1			11				B0BLXXY7N3						B0BLXXY7N3				AMAZON_NA	Migrated Template	Inactive
3.5# Small Breed Red Meat Blend		0403BBNXCTV	4S-IG60-WH8V	34.99		2024-04-03 08:34:26 PDT		y	1			11				B07B5T33M4						B07B5T33M4				AMAZON_NA	Migrated Template	Inactive
Liqui Moly 2020 Motor Oil Saver - 300 ml		0409BRTFW8Y	4T-EAYG-LPRK	22		2024-04-09 06:06:54 PDT		y	1			11				B071L8GB45						B071L8GB45				AMAZON_NA	Migrated Template	Inactive
Combat Large + Small Roaches Roach Killing Bait Stations, 12 Count		0109BOWIT6S	4T-TP45-W0CI	9.99		2024-01-09 13:42:30 PST		y	1			11				B0CB71HRGG						B0CB71HRGG				AMAZON_NA	Migrated Template	Inactive
Nizoral A-D Shampoo, 1%, 7oz		0517A1O3RN5	4Z-CWCK-SCC0	15.88		2023-05-17 06:21:29 PDT		y	1			11				B00HSUUYG0						B00HSUUYG0				AMAZON_NA	Migrated Template	Inactive
Dove Men Body Wash Clean Comfort 1 Liter (33.8 Oz) - Pack of 2		1012ADDI377	4Z-TWIC-HRZZ	28.99		2023-10-12 10:30:22 PDT		y	1			11				B09LJ2RBH4						B09LJ2RBH4				AMAZON_NA	Migrated Template	Inactive
Dr. Marty Nature's Feast Essential Wellness Poultry Dry Cat Food 12 oz		0306BA7N5O1	4Z-UWN0-U47W	48.99		2024-03-06 11:16:57 PST		y	1			11				B0BNW5V1TV						B0BNW5V1TV				AMAZON_NA	Migrated Template	Inactive
Gilmour Continuous Plastic Salt Water Nozzle		0922AXN8KT1	52-2WIJ-9CEI	10.99		2023-09-22 11:19:58 PDT		y	1			11				B073PG25CM						B073PG25CM				AMAZON_NA	Migrated Template	Inactive
Dechra Trizchlor 4 Wipes for Dogs & Cats 50 Ct		0220B8T2TBJ	54-IKXW-1FVF	23.98		2024-02-20 08:37:35 PST		y	1			11				B01J916O9G						B01J916O9G				AMAZON_NA	Migrated Template	Inactive
ANIMED VIA-Calm 5 lb Pail 90452 Pail 90452…		1127AP8NBA2	54-X7PV-IJAL	47.99		2023-11-27 11:32:58 PST		y	1			11				B00E8GL2UY						B00E8GL2UY				AMAZON_NA	Migrated Template	Inactive
Finish Dishwasher Detergent Salt, 2 KG		0208BO2MZ6O	59-NGA3-6AM2	24.99		2024-02-08 11:43:03 PST		y	1			11				B07CR76MLY						B07CR76MLY				AMAZON_NA	Migrated Template	Inactive
AtopiCream HC Leave-in 1% Hydrocortisone Conditioner Moisturizer for Dogs with Dry, Itchy Skin and Allergies, Pet Itch Relief, 8 oz		1220ADL39JV	5C-PFDN-HV41	26.64		2023-12-20 05:44:49 PST		y	1			11				B077S5VLZX						B077S5VLZX				AMAZON_NA	Migrated Template	Inactive
L'Oréal Paris Kids Extra Gentle 2in1 Shampoo - Very Berry Strawberry (250ml)		0228BR8SH3L	5F-TDTD-ZU5M	13.99		2024-02-28 11:53:02 PST		y	1			11				B001RYOOUK						B001RYOOUK				AMAZON_NA	Migrated Template	Inactive
Open Farm, Rustic Stew Wild-Caught Salmon Recipe Wet Dog Food, 12.5 Ounce, 12 Pack		0116B5L99WK	5F-VPKG-VEA4	50.99		2024-01-16 08:36:57 PST		y	1			11				B07G3M19BC						B07G3M19BC				AMAZON_NA	Migrated Template	Inactive
Wormx Plus DeWormer, Large Dog, 6-Ct.		0411A2V9TKF	5H-TPVS-LRTO	35.99		2023-04-11 08:07:53 PDT		y	1			11				B0799S67K7						B0799S67K7				AMAZON_NA	Migrated Template	Inactive
Quaker Old Fashioned Oatmeal, Breakfast Cereal, 42 Oz., (2 Canisters)_AB		0109BP0PX4S	5I-78OO-X5AT	23		2024-01-09 13:44:19 PST		y	1			11				B07BP86BKK						B07BP86BKK				AMAZON_NA	Migrated Template	Inactive
Delta Foundations 4 in. Centerset Single-Handle Pro-Pak Bathroom Faucet in Chrome (2-Pack)		0629AGN6OVO	5J-Y3O8-KZJF	65.99		2023-06-29 13:52:32 PDT		y	1			11				B01FPVBFQG						B01FPVBFQG				AMAZON_NA	Migrated Template	Inactive
Johnson & Johnson Baby Creamy Oil, Aloe Vera & Vitamin E, 8 fl oz (4-Pack)		0928AD55789	5K-P8TN-WT9W	30.2		2023-09-28 12:01:23 PDT		y	1			11				B00G4EKR54						B00G4EKR54				AMAZON_NA	Migrated Template	Inactive
Pet Tabs Original Formula Vitamin Supplement, 180 Count		0404BD4AQL2	5K-XVQP-FGDP	50.2		2024-04-03 19:34:50 PDT		y	1			11				B0002DJDYY						B0002DJDYY				AMAZON_NA	Migrated Template	Inactive
Redbarn All-Natural Bully Slims Beef Esophagus Chew Treats - Premium Grain-Free High Protein Low Fat Rawhide Alternative with No Artifical Ingredients - 4.7 oz Bag		0319B8HQFC7	5M-JZF3-6C6S	24.69		2024-03-19 06:24:39 PDT		y	1			11				B07G9P3LRR						B07G9P3LRR				AMAZON_NA	Migrated Template	Inactive
